InvoiceNo,StockCode,Description,Quantity,InvoiceDate,UnitPrice,customer_id,Country,review_score,product_id
536365,85123A,WHITE HANGING HEART T-LIGHT HOLDER,6,12-01-2010 8:26,2.55,17850,United Kingdom,5,1376722
536365,71053,WHITE METAL LANTERN,6,12-01-2010 8:26,3.39,17850,United Kingdom,4,1440895
536365,84406B,CREAM CUPID HEARTS COAT HANGER,8,12-01-2010 8:26,2.75,17850,United Kingdom,1,1842335
536365,84029G,KNITTED UNION FLAG HOT WATER BOTTLE,6,12-01-2010 8:26,3.39,17850,United Kingdom,1,1556721
536365,84029E,RED WOOLLY HOTTIE WHITE HEART.,6,12-01-2010 8:26,3.39,17850,United Kingdom,2,1057706
536365,22752,SET 7 BABUSHKA NESTING BOXES,2,12-01-2010 8:26,7.65,17850,United Kingdom,2,1242347
536365,21730,GLASS STAR FROSTED T-LIGHT HOLDER,6,12-01-2010 8:26,4.25,17850,United Kingdom,4,1612741
536366,22633,HAND WARMER UNION JACK,6,12-01-2010 8:28,1.85,17850,United Kingdom,4,1414409
536366,22632,HAND WARMER RED POLKA DOT,6,12-01-2010 8:28,1.85,17850,United Kingdom,4,1536938
536367,84879,ASSORTED COLOUR BIRD ORNAMENT,32,12-01-2010 8:34,1.69,13047,United Kingdom,2,1414252
536367,22745,POPPY'S PLAYHOUSE BEDROOM,6,12-01-2010 8:34,2.1,13047,United Kingdom,2,1521142
536367,22748,POPPY'S PLAYHOUSE KITCHEN,6,12-01-2010 8:34,2.1,13047,United Kingdom,4,1679529
536367,22749,FELTCRAFT PRINCESS CHARLOTTE DOLL,8,12-01-2010 8:34,3.75,13047,United Kingdom,5,1360406
536367,22310,IVORY KNITTED MUG COSY,6,12-01-2010 8:34,1.65,13047,United Kingdom,2,1371895
536367,84969,BOX OF 6 ASSORTED COLOUR TEASPOONS,6,12-01-2010 8:34,4.25,13047,United Kingdom,3,1857001
536367,22623,BOX OF VINTAGE JIGSAW BLOCKS,3,12-01-2010 8:34,4.95,13047,United Kingdom,4,1562497
536367,22622,BOX OF VINTAGE ALPHABET BLOCKS,2,12-01-2010 8:34,9.95,13047,United Kingdom,3,1186330
536367,21754,HOME BUILDING BLOCK WORD,3,12-01-2010 8:34,5.95,13047,United Kingdom,4,1731964
536367,21755,LOVE BUILDING BLOCK WORD,3,12-01-2010 8:34,5.95,13047,United Kingdom,1,1932352
536367,21777,RECIPE BOX WITH METAL HEART,4,12-01-2010 8:34,7.95,13047,United Kingdom,4,1753869
536367,48187,DOORMAT NEW ENGLAND,4,12-01-2010 8:34,7.95,13047,United Kingdom,4,1484123
536368,22960,JAM MAKING SET WITH JARS,6,12-01-2010 8:34,4.25,13047,United Kingdom,1,1986013
536368,22913,RED COAT RACK PARIS FASHION,3,12-01-2010 8:34,4.95,13047,United Kingdom,1,1295063
536368,22912,YELLOW COAT RACK PARIS FASHION,3,12-01-2010 8:34,4.95,13047,United Kingdom,2,1706948
536368,22914,BLUE COAT RACK PARIS FASHION,3,12-01-2010 8:34,4.95,13047,United Kingdom,4,1138578
536369,21756,BATH BUILDING BLOCK WORD,3,12-01-2010 8:35,5.95,13047,United Kingdom,2,1598016
536370,22728,ALARM CLOCK BAKELIKE PINK,24,12-01-2010 8:45,3.75,12583,France,1,1148065
536370,22727,ALARM CLOCK BAKELIKE RED,24,12-01-2010 8:45,3.75,12583,France,3,1804535
536370,22726,ALARM CLOCK BAKELIKE GREEN,12,12-01-2010 8:45,3.75,12583,France,4,1259240
536370,21724,PANDA AND BUNNIES STICKER SHEET,12,12-01-2010 8:45,0.85,12583,France,5,1912156
536370,21883,STARS GIFT TAPE,24,12-01-2010 8:45,0.65,12583,France,5,1034734
536370,10002,INFLATABLE POLITICAL GLOBE,48,12-01-2010 8:45,0.85,12583,France,3,1872594
536370,21791,VINTAGE HEADS AND TAILS CARD GAME,24,12-01-2010 8:45,1.25,12583,France,1,1554483
536370,21035,SET/2 RED RETROSPOT TEA TOWELS,18,12-01-2010 8:45,2.95,12583,France,1,1011855
536370,22326,ROUND SNACK BOXES SET OF4 WOODLAND,24,12-01-2010 8:45,2.95,12583,France,1,1613376
536370,22629,SPACEBOY LUNCH BOX,24,12-01-2010 8:45,1.95,12583,France,3,1086663
536370,22659,LUNCH BOX I LOVE LONDON,24,12-01-2010 8:45,1.95,12583,France,5,1345647
536370,22631,CIRCUS PARADE LUNCH BOX,24,12-01-2010 8:45,1.95,12583,France,5,1332232
536370,22661,CHARLOTTE BAG DOLLY GIRL DESIGN,20,12-01-2010 8:45,0.85,12583,France,1,1262618
536370,21731,RED TOADSTOOL LED NIGHT LIGHT,24,12-01-2010 8:45,1.65,12583,France,4,1306066
536370,22900,SET 2 TEA TOWELS I LOVE LONDON,24,12-01-2010 8:45,2.95,12583,France,2,1668653
536370,21913,VINTAGE SEASIDE JIGSAW PUZZLES,12,12-01-2010 8:45,3.75,12583,France,2,1395479
536370,22540,MINI JIGSAW CIRCUS PARADE,24,12-01-2010 8:45,0.42,12583,France,2,1334797
536370,22544,MINI JIGSAW SPACEBOY,24,12-01-2010 8:45,0.42,12583,France,2,1266486
536370,22492,MINI PAINT SET VINTAGE,36,12-01-2010 8:45,0.65,12583,France,2,1938829
536370,POST,POSTAGE,3,12-01-2010 8:45,18,12583,France,4,1512380
536371,22086,PAPER CHAIN KIT 50'S CHRISTMAS,80,12-01-2010 9:00,2.55,13748,United Kingdom,5,1105803
536372,22632,HAND WARMER RED POLKA DOT,6,12-01-2010 9:01,1.85,17850,United Kingdom,2,1863253
536372,22633,HAND WARMER UNION JACK,6,12-01-2010 9:01,1.85,17850,United Kingdom,3,1339257
536373,85123A,WHITE HANGING HEART T-LIGHT HOLDER,6,12-01-2010 9:02,2.55,17850,United Kingdom,4,1672974
536373,71053,WHITE METAL LANTERN,6,12-01-2010 9:02,3.39,17850,United Kingdom,5,1857584
536373,84406B,CREAM CUPID HEARTS COAT HANGER,8,12-01-2010 9:02,2.75,17850,United Kingdom,3,1965667
536373,20679,EDWARDIAN PARASOL RED,6,12-01-2010 9:02,4.95,17850,United Kingdom,1,1433782
536373,37370,RETRO COFFEE MUGS ASSORTED,6,12-01-2010 9:02,1.06,17850,United Kingdom,3,1135590
536373,21871,SAVE THE PLANET MUG,6,12-01-2010 9:02,1.06,17850,United Kingdom,3,1073442
536373,21071,VINTAGE BILLBOARD DRINK ME MUG,6,12-01-2010 9:02,1.06,17850,United Kingdom,1,1816962
536373,21068,VINTAGE BILLBOARD LOVE/HATE MUG,6,12-01-2010 9:02,1.06,17850,United Kingdom,3,1502860
536373,82483,WOOD 2 DRAWER CABINET WHITE FINISH,2,12-01-2010 9:02,4.95,17850,United Kingdom,1,1415792
536373,82486,WOOD S/3 CABINET ANT WHITE FINISH,4,12-01-2010 9:02,6.95,17850,United Kingdom,4,1426451
536373,82482,WOODEN PICTURE FRAME WHITE FINISH,6,12-01-2010 9:02,2.1,17850,United Kingdom,1,1095009
536373,82494L,WOODEN FRAME ANTIQUE WHITE,6,12-01-2010 9:02,2.55,17850,United Kingdom,2,1753787
536373,84029G,KNITTED UNION FLAG HOT WATER BOTTLE,6,12-01-2010 9:02,3.39,17850,United Kingdom,3,1475455
536373,84029E,RED WOOLLY HOTTIE WHITE HEART.,6,12-01-2010 9:02,3.39,17850,United Kingdom,5,1097756
536373,22752,SET 7 BABUSHKA NESTING BOXES,2,12-01-2010 9:02,7.65,17850,United Kingdom,2,1135617
536373,21730,GLASS STAR FROSTED T-LIGHT HOLDER,6,12-01-2010 9:02,4.25,17850,United Kingdom,2,1866386
536374,21258,VICTORIAN SEWING BOX LARGE,32,12-01-2010 9:09,10.95,15100,United Kingdom,4,1917045
536375,85123A,WHITE HANGING HEART T-LIGHT HOLDER,6,12-01-2010 9:32,2.55,17850,United Kingdom,3,1974247
536375,71053,WHITE METAL LANTERN,6,12-01-2010 9:32,3.39,17850,United Kingdom,5,1653315
536375,84406B,CREAM CUPID HEARTS COAT HANGER,8,12-01-2010 9:32,2.75,17850,United Kingdom,4,1301063
536375,20679,EDWARDIAN PARASOL RED,6,12-01-2010 9:32,4.95,17850,United Kingdom,1,1899325
536375,37370,RETRO COFFEE MUGS ASSORTED,6,12-01-2010 9:32,1.06,17850,United Kingdom,4,1443996
536375,21871,SAVE THE PLANET MUG,6,12-01-2010 9:32,1.06,17850,United Kingdom,3,1533724
536375,21071,VINTAGE BILLBOARD DRINK ME MUG,6,12-01-2010 9:32,1.06,17850,United Kingdom,3,1418227
536375,21068,VINTAGE BILLBOARD LOVE/HATE MUG,6,12-01-2010 9:32,1.06,17850,United Kingdom,4,1308089
536375,82483,WOOD 2 DRAWER CABINET WHITE FINISH,2,12-01-2010 9:32,4.95,17850,United Kingdom,2,1833090
536375,82486,WOOD S/3 CABINET ANT WHITE FINISH,4,12-01-2010 9:32,6.95,17850,United Kingdom,4,1917169
536375,82482,WOODEN PICTURE FRAME WHITE FINISH,6,12-01-2010 9:32,2.1,17850,United Kingdom,5,1736347
536375,82494L,WOODEN FRAME ANTIQUE WHITE,6,12-01-2010 9:32,2.55,17850,United Kingdom,2,1439150
536375,84029G,KNITTED UNION FLAG HOT WATER BOTTLE,6,12-01-2010 9:32,3.39,17850,United Kingdom,2,1008894
536375,84029E,RED WOOLLY HOTTIE WHITE HEART.,6,12-01-2010 9:32,3.39,17850,United Kingdom,1,1844915
536375,22752,SET 7 BABUSHKA NESTING BOXES,2,12-01-2010 9:32,7.65,17850,United Kingdom,5,1590547
536375,21730,GLASS STAR FROSTED T-LIGHT HOLDER,6,12-01-2010 9:32,4.25,17850,United Kingdom,4,1080701
536376,22114,HOT WATER BOTTLE TEA AND SYMPATHY,48,12-01-2010 9:32,3.45,15291,United Kingdom,2,1312515
536376,21733,RED HANGING HEART T-LIGHT HOLDER,64,12-01-2010 9:32,2.55,15291,United Kingdom,5,1197432
536377,22632,HAND WARMER RED POLKA DOT,6,12-01-2010 9:34,1.85,17850,United Kingdom,3,1044414
536377,22633,HAND WARMER UNION JACK,6,12-01-2010 9:34,1.85,17850,United Kingdom,2,1418298
536378,22386,JUMBO BAG PINK POLKADOT,10,12-01-2010 9:37,1.95,14688,United Kingdom,3,1777140
536378,85099C,JUMBO  BAG BAROQUE BLACK WHITE,10,12-01-2010 9:37,1.95,14688,United Kingdom,2,1518346
536378,21033,JUMBO BAG CHARLIE AND LOLA TOYS,10,12-01-2010 9:37,2.95,14688,United Kingdom,1,1154786
536378,20723,STRAWBERRY CHARLOTTE BAG,10,12-01-2010 9:37,0.85,14688,United Kingdom,4,1628100
536378,84997B,RED 3 PIECE RETROSPOT CUTLERY SET,12,12-01-2010 9:37,3.75,14688,United Kingdom,1,1539157
536378,84997C,BLUE 3 PIECE POLKADOT CUTLERY SET,6,12-01-2010 9:37,3.75,14688,United Kingdom,5,1588239
536378,21094,SET/6 RED SPOTTY PAPER PLATES,12,12-01-2010 9:37,0.85,14688,United Kingdom,5,1592594
536378,20725,LUNCH BAG RED RETROSPOT,10,12-01-2010 9:37,1.65,14688,United Kingdom,3,1372613
536378,21559,STRAWBERRY LUNCH BOX WITH CUTLERY,6,12-01-2010 9:37,2.55,14688,United Kingdom,4,1455395
536378,22352,LUNCH BOX WITH CUTLERY RETROSPOT,6,12-01-2010 9:37,2.55,14688,United Kingdom,2,1289227
536378,21212,PACK OF 72 RETROSPOT CAKE CASES,120,12-01-2010 9:37,0.42,14688,United Kingdom,1,1182428
536378,21975,PACK OF 60 DINOSAUR CAKE CASES,24,12-01-2010 9:37,0.55,14688,United Kingdom,3,1668116
536378,21977,PACK OF 60 PINK PAISLEY CAKE CASES,24,12-01-2010 9:37,0.55,14688,United Kingdom,2,1202493
536378,84991,60 TEATIME FAIRY CAKE CASES,24,12-01-2010 9:37,0.55,14688,United Kingdom,4,1384254
536378,84519A,TOMATO CHARLIE+LOLA COASTER SET,6,12-01-2010 9:37,2.95,14688,United Kingdom,2,1139281
536378,85183B,CHARLIE & LOLA WASTEPAPER BIN FLORA,48,12-01-2010 9:37,1.25,14688,United Kingdom,5,1754010
536378,85071B,RED CHARLIE+LOLA PERSONAL DOORSIGN,96,12-01-2010 9:37,0.38,14688,United Kingdom,1,1553407
536378,21931,JUMBO STORAGE BAG SUKI,10,12-01-2010 9:37,1.95,14688,United Kingdom,5,1324266
536378,21929,JUMBO BAG PINK VINTAGE PAISLEY,10,12-01-2010 9:37,1.95,14688,United Kingdom,2,1653031
536380,22961,JAM MAKING SET PRINTED,24,12-01-2010 9:41,1.45,17809,United Kingdom,2,1661787
536381,22139,RETROSPOT TEA SET CERAMIC 11 PC,23,12-01-2010 9:41,4.25,15311,United Kingdom,4,1101193
536381,84854,GIRLY PINK TOOL SET,5,12-01-2010 9:41,4.95,15311,United Kingdom,4,1091999
536381,22411,JUMBO SHOPPER VINTAGE RED PAISLEY,10,12-01-2010 9:41,1.95,15311,United Kingdom,3,1999504
536381,82567,"AIRLINE LOUNGE,METAL SIGN",2,12-01-2010 9:41,2.1,15311,United Kingdom,3,1154887
536381,21672,WHITE SPOT RED CERAMIC DRAWER KNOB,6,12-01-2010 9:41,1.25,15311,United Kingdom,4,1431721
536381,22774,RED DRAWER KNOB ACRYLIC EDWARDIAN,24,12-01-2010 9:41,1.25,15311,United Kingdom,3,1392805
536381,22771,CLEAR DRAWER KNOB ACRYLIC EDWARDIAN,24,12-01-2010 9:41,1.25,15311,United Kingdom,3,1541576
536381,71270,PHOTO CLIP LINE,1,12-01-2010 9:41,1.25,15311,United Kingdom,4,1590649
536381,22262,FELT EGG COSY CHICKEN,1,12-01-2010 9:41,0.85,15311,United Kingdom,2,1634591
536381,22637,PIGGY BANK RETROSPOT,1,12-01-2010 9:41,2.55,15311,United Kingdom,3,1211000
536381,21934,SKULL SHOULDER BAG,10,12-01-2010 9:41,1.65,15311,United Kingdom,1,1824554
536381,21169,YOU'RE CONFUSING ME METAL SIGN,3,12-01-2010 9:41,1.69,15311,United Kingdom,5,1041627
536381,21166,COOK WITH WINE METAL SIGN,1,12-01-2010 9:41,1.95,15311,United Kingdom,4,1085547
536381,21175,GIN + TONIC DIET METAL SIGN,2,12-01-2010 9:41,2.1,15311,United Kingdom,3,1864441
536381,37444A,YELLOW BREAKFAST CUP AND SAUCER,1,12-01-2010 9:41,2.95,15311,United Kingdom,1,1467154
536381,37444C,PINK BREAKFAST CUP AND SAUCER,1,12-01-2010 9:41,2.95,15311,United Kingdom,2,1706018
536381,22086,PAPER CHAIN KIT 50'S CHRISTMAS,4,12-01-2010 9:41,2.95,15311,United Kingdom,1,1633822
536381,22083,PAPER CHAIN KIT RETROSPOT,1,12-01-2010 9:41,2.95,15311,United Kingdom,5,1210567
536381,84971S,SMALL HEART FLOWERS HOOK,6,12-01-2010 9:41,0.85,15311,United Kingdom,3,1702740
536381,71270,PHOTO CLIP LINE,3,12-01-2010 9:41,1.25,15311,United Kingdom,4,1235471
536381,47580,TEA TIME DES TEA COSY,2,12-01-2010 9:41,2.55,15311,United Kingdom,2,1684304
536381,22261,FELT EGG COSY WHITE RABBIT,1,12-01-2010 9:41,0.85,15311,United Kingdom,5,1583899
536381,84832,ZINC WILLIE WINKIE  CANDLE STICK,1,12-01-2010 9:41,0.85,15311,United Kingdom,4,1235023
536381,22644,CERAMIC CHERRY CAKE MONEY BANK,1,12-01-2010 9:41,1.45,15311,United Kingdom,2,1113535
536381,21533,RETROSPOT LARGE MILK JUG,1,12-01-2010 9:41,4.95,15311,United Kingdom,2,1177151
536381,21557,SET OF 6 FUNKY BEAKERS,2,12-01-2010 9:41,2.95,15311,United Kingdom,5,1377965
536381,15056BL,EDWARDIAN PARASOL BLACK,2,12-01-2010 9:41,5.95,15311,United Kingdom,2,1538261
536381,15056N,EDWARDIAN PARASOL NATURAL,2,12-01-2010 9:41,5.95,15311,United Kingdom,5,1629057
536381,22646,CERAMIC STRAWBERRY CAKE MONEY BANK,4,12-01-2010 9:41,1.45,15311,United Kingdom,3,1136358
536381,22176,BLUE OWL SOFT TOY,1,12-01-2010 9:41,2.95,15311,United Kingdom,2,1923947
536381,22438,BALLOON ART MAKE YOUR OWN FLOWERS,1,12-01-2010 9:41,1.95,15311,United Kingdom,4,1854070
536381,21731,RED TOADSTOOL LED NIGHT LIGHT,2,12-01-2010 9:41,1.65,15311,United Kingdom,4,1306263
536381,22778,GLASS CLOCHE SMALL,3,12-01-2010 9:41,3.95,15311,United Kingdom,3,1284026
536381,22719,GUMBALL MONOCHROME COAT RACK,36,12-01-2010 9:41,1.06,15311,United Kingdom,4,1463761
536381,21523,DOORMAT FANCY FONT HOME SWEET HOME,10,12-01-2010 9:41,6.75,15311,United Kingdom,5,1915258
C536379,D,Discount,-1,12-01-2010 9:41,27.5,14527,United Kingdom,3,1876893
536382,10002,INFLATABLE POLITICAL GLOBE,12,12-01-2010 9:45,0.85,16098,United Kingdom,2,1198519
536382,21912,VINTAGE SNAKES & LADDERS,8,12-01-2010 9:45,3.75,16098,United Kingdom,3,1567131
536382,21832,CHOCOLATE CALCULATOR,12,12-01-2010 9:45,1.65,16098,United Kingdom,1,1861702
536382,22411,JUMBO SHOPPER VINTAGE RED PAISLEY,10,12-01-2010 9:45,1.95,16098,United Kingdom,1,1009604
536382,22379,RECYCLING BAG RETROSPOT,10,12-01-2010 9:45,2.1,16098,United Kingdom,1,1632375
536382,22381,TOY TIDY PINK POLKADOT,50,12-01-2010 9:45,1.85,16098,United Kingdom,4,1300146
536382,22798,ANTIQUE GLASS DRESSING TABLE POT,8,12-01-2010 9:45,2.95,16098,United Kingdom,1,1904058
536382,22726,ALARM CLOCK BAKELIKE GREEN,4,12-01-2010 9:45,3.75,16098,United Kingdom,3,1048046
536382,22926,IVORY GIANT GARDEN THERMOMETER,12,12-01-2010 9:45,5.95,16098,United Kingdom,2,1899791
536382,22839,3 TIER CAKE TIN GREEN AND CREAM,2,12-01-2010 9:45,14.95,16098,United Kingdom,1,1817116
536382,22838,3 TIER CAKE TIN RED AND CREAM,2,12-01-2010 9:45,14.95,16098,United Kingdom,2,1038211
536382,22783,SET 3 WICKER OVAL BASKETS W LIDS,4,12-01-2010 9:45,16.95,16098,United Kingdom,4,1951335
C536383,35004C,SET OF 3 COLOURED  FLYING DUCKS,-1,12-01-2010 9:49,4.65,15311,United Kingdom,3,1693704
536384,82484,WOOD BLACK BOARD ANT WHITE FINISH,3,12-01-2010 9:53,6.45,18074,United Kingdom,2,1817987
536384,84755,COLOUR GLASS T-LIGHT HOLDER HANGING,48,12-01-2010 9:53,0.65,18074,United Kingdom,1,1516662
536384,22464,HANGING METAL HEART LANTERN,12,12-01-2010 9:53,1.65,18074,United Kingdom,4,1479336
536384,21324,HANGING MEDINA LANTERN SMALL,6,12-01-2010 9:53,2.95,18074,United Kingdom,1,1298930
536384,22457,NATURAL SLATE HEART CHALKBOARD,12,12-01-2010 9:53,2.95,18074,United Kingdom,5,1490399
536384,22469,HEART OF WICKER SMALL,40,12-01-2010 9:53,1.45,18074,United Kingdom,5,1842632
536384,22470,HEART OF WICKER LARGE,40,12-01-2010 9:53,2.55,18074,United Kingdom,3,1420025
536384,22224,WHITE LOVEBIRD LANTERN,6,12-01-2010 9:53,2.95,18074,United Kingdom,3,1930505
536384,21340,CLASSIC METAL BIRDCAGE PLANT HOLDER,2,12-01-2010 9:53,12.75,18074,United Kingdom,5,1138405
536384,22189,CREAM HEART CARD HOLDER,4,12-01-2010 9:53,3.95,18074,United Kingdom,3,1768481
536384,22427,ENAMEL FLOWER JUG CREAM,3,12-01-2010 9:53,5.95,18074,United Kingdom,5,1317311
536384,22428,ENAMEL FIRE BUCKET CREAM,6,12-01-2010 9:53,6.95,18074,United Kingdom,5,1845342
536384,22424,ENAMEL BREAD BIN CREAM,8,12-01-2010 9:53,10.95,18074,United Kingdom,5,1689203
536385,22783,SET 3 WICKER OVAL BASKETS W LIDS,1,12-01-2010 9:56,19.95,17420,United Kingdom,5,1152117
536385,22961,JAM MAKING SET PRINTED,12,12-01-2010 9:56,1.45,17420,United Kingdom,1,1725141
536385,22960,JAM MAKING SET WITH JARS,6,12-01-2010 9:56,4.25,17420,United Kingdom,4,1950505
536385,22663,JUMBO BAG DOLLY GIRL DESIGN,10,12-01-2010 9:56,1.95,17420,United Kingdom,4,1664669
536385,85049A,TRADITIONAL CHRISTMAS RIBBONS,12,12-01-2010 9:56,1.25,17420,United Kingdom,3,1553371
536385,22168,ORGANISER WOOD ANTIQUE WHITE,2,12-01-2010 9:56,8.5,17420,United Kingdom,2,1487280
536385,22662,LUNCH BAG DOLLY GIRL DESIGN,10,12-01-2010 9:56,1.65,17420,United Kingdom,3,1862825
536386,84880,WHITE WIRE EGG HOLDER,36,12-01-2010 9:57,4.95,16029,United Kingdom,1,1006303
536386,85099C,JUMBO  BAG BAROQUE BLACK WHITE,100,12-01-2010 9:57,1.65,16029,United Kingdom,2,1136895
536386,85099B,JUMBO BAG RED RETROSPOT,100,12-01-2010 9:57,1.65,16029,United Kingdom,1,1922087
536387,79321,CHILLI LIGHTS,192,12-01-2010 9:58,3.82,16029,United Kingdom,1,1762310
536387,22780,LIGHT GARLAND BUTTERFILES PINK,192,12-01-2010 9:58,3.37,16029,United Kingdom,5,1350156
536387,22779,WOODEN OWLS LIGHT GARLAND,192,12-01-2010 9:58,3.37,16029,United Kingdom,2,1788995
536387,22466,FAIRY TALE COTTAGE NIGHTLIGHT,432,12-01-2010 9:58,1.45,16029,United Kingdom,4,1077700
536387,21731,RED TOADSTOOL LED NIGHT LIGHT,432,12-01-2010 9:58,1.25,16029,United Kingdom,4,1925728
536388,21754,HOME BUILDING BLOCK WORD,3,12-01-2010 9:59,5.95,16250,United Kingdom,2,1962586
536388,21755,LOVE BUILDING BLOCK WORD,3,12-01-2010 9:59,5.95,16250,United Kingdom,3,1352793
536388,21523,DOORMAT FANCY FONT HOME SWEET HOME,2,12-01-2010 9:59,7.95,16250,United Kingdom,4,1415491
536388,21363,HOME SMALL WOOD LETTERS,3,12-01-2010 9:59,4.95,16250,United Kingdom,2,1526944
536388,21411,GINGHAM HEART  DOORSTOP RED,3,12-01-2010 9:59,4.25,16250,United Kingdom,2,1568202
536388,22318,FIVE HEART HANGING DECORATION,6,12-01-2010 9:59,2.95,16250,United Kingdom,5,1539541
536388,22464,HANGING METAL HEART LANTERN,12,12-01-2010 9:59,1.65,16250,United Kingdom,3,1378180
536388,22915,ASSORTED BOTTLE TOP  MAGNETS,12,12-01-2010 9:59,0.42,16250,United Kingdom,4,1147023
536388,22922,FRIDGE MAGNETS US DINER ASSORTED,12,12-01-2010 9:59,0.85,16250,United Kingdom,3,1728113
536388,22969,HOMEMADE JAM SCENTED CANDLES,12,12-01-2010 9:59,1.45,16250,United Kingdom,2,1383394
536388,22923,FRIDGE MAGNETS LES ENFANTS ASSORTED,12,12-01-2010 9:59,0.85,16250,United Kingdom,3,1304008
536388,21115,ROSE CARAVAN DOORSTOP,4,12-01-2010 9:59,6.75,16250,United Kingdom,3,1449841
536388,22469,HEART OF WICKER SMALL,12,12-01-2010 9:59,1.65,16250,United Kingdom,4,1259583
536388,22242,5 HOOK HANGER MAGIC TOADSTOOL,12,12-01-2010 9:59,1.65,16250,United Kingdom,4,1072818
536389,22941,CHRISTMAS LIGHTS 10 REINDEER,6,12-01-2010 10:03,8.5,12431,Australia,1,1059390
536389,21622,VINTAGE UNION JACK CUSHION COVER,8,12-01-2010 10:03,4.95,12431,Australia,3,1647838
536389,21791,VINTAGE HEADS AND TAILS CARD GAME,12,12-01-2010 10:03,1.25,12431,Australia,5,1427485
536389,35004C,SET OF 3 COLOURED  FLYING DUCKS,6,12-01-2010 10:03,5.45,12431,Australia,1,1613853
536389,35004G,SET OF 3 GOLD FLYING DUCKS,4,12-01-2010 10:03,6.35,12431,Australia,4,1579915
536389,85014B,RED RETROSPOT UMBRELLA,6,12-01-2010 10:03,5.95,12431,Australia,3,1707804
536389,85014A,BLACK/BLUE POLKADOT UMBRELLA,3,12-01-2010 10:03,5.95,12431,Australia,3,1283438
536389,22193,RED DINER WALL CLOCK,2,12-01-2010 10:03,8.5,12431,Australia,5,1058787
536389,22726,ALARM CLOCK BAKELIKE GREEN,4,12-01-2010 10:03,3.75,12431,Australia,5,1233173
536389,22727,ALARM CLOCK BAKELIKE RED,4,12-01-2010 10:03,3.75,12431,Australia,3,1727977
536389,22192,BLUE DINER WALL CLOCK,2,12-01-2010 10:03,8.5,12431,Australia,5,1580260
536389,22191,IVORY DINER WALL CLOCK,2,12-01-2010 10:03,8.5,12431,Australia,1,1968379
536389,22195,LARGE HEART MEASURING SPOONS,24,12-01-2010 10:03,1.65,12431,Australia,2,1546785
536389,22196,SMALL HEART MEASURING SPOONS,24,12-01-2010 10:03,0.85,12431,Australia,2,1555470
536390,22941,CHRISTMAS LIGHTS 10 REINDEER,2,12-01-2010 10:19,8.5,17511,United Kingdom,2,1147396
536390,22960,JAM MAKING SET WITH JARS,12,12-01-2010 10:19,3.75,17511,United Kingdom,5,1366526
536390,22961,JAM MAKING SET PRINTED,12,12-01-2010 10:19,1.45,17511,United Kingdom,4,1381107
536390,22962,JAM JAR WITH PINK LID,48,12-01-2010 10:19,0.72,17511,United Kingdom,2,1506965
536390,22963,JAM JAR WITH GREEN LID,48,12-01-2010 10:19,0.72,17511,United Kingdom,3,1477235
536390,22968,ROSE COTTAGE KEEPSAKE BOX,8,12-01-2010 10:19,8.5,17511,United Kingdom,2,1693450
536390,84970S,HANGING HEART ZINC T-LIGHT HOLDER,144,12-01-2010 10:19,0.64,17511,United Kingdom,3,1068525
536390,22910,PAPER CHAIN KIT VINTAGE CHRISTMAS,40,12-01-2010 10:19,2.55,17511,United Kingdom,2,1005814
536390,20668,DISCO BALL CHRISTMAS DECORATION,288,12-01-2010 10:19,0.1,17511,United Kingdom,5,1542705
536390,85123A,WHITE HANGING HEART T-LIGHT HOLDER,64,12-01-2010 10:19,2.55,17511,United Kingdom,3,1166681
536390,22197,SMALL POPCORN HOLDER,100,12-01-2010 10:19,0.72,17511,United Kingdom,3,1389827
536390,22198,LARGE POPCORN HOLDER,50,12-01-2010 10:19,1.45,17511,United Kingdom,1,1055140
536390,21533,RETROSPOT LARGE MILK JUG,12,12-01-2010 10:19,4.25,17511,United Kingdom,1,1543361
536390,21080,SET/20 RED RETROSPOT PAPER NAPKINS,96,12-01-2010 10:19,0.64,17511,United Kingdom,4,1518768
536390,21094,SET/6 RED SPOTTY PAPER PLATES,96,12-01-2010 10:19,0.64,17511,United Kingdom,5,1513055
536390,21086,SET/6 RED SPOTTY PAPER CUPS,48,12-01-2010 10:19,0.65,17511,United Kingdom,1,1729213
536390,21786,POLKADOT RAIN HAT,144,12-01-2010 10:19,0.32,17511,United Kingdom,2,1360117
536390,22654,DELUXE SEWING KIT,40,12-01-2010 10:19,4.95,17511,United Kingdom,2,1296437
536390,21485,RETROSPOT HEART HOT WATER BOTTLE,24,12-01-2010 10:19,4.25,17511,United Kingdom,5,1181382
536390,84029G,KNITTED UNION FLAG HOT WATER BOTTLE,24,12-01-2010 10:19,3.39,17511,United Kingdom,4,1284327
536390,84030E,ENGLISH ROSE HOT WATER BOTTLE,24,12-01-2010 10:19,3.75,17511,United Kingdom,1,1988068
536390,22174,PHOTO CUBE,48,12-01-2010 10:19,1.48,17511,United Kingdom,2,1777985
536390,22969,HOMEMADE JAM SCENTED CANDLES,96,12-01-2010 10:19,1.25,17511,United Kingdom,2,1503903
536390,85099B,JUMBO BAG RED RETROSPOT,100,12-01-2010 10:19,1.65,17511,United Kingdom,5,1065612
C536391,22556,PLASTERS IN TIN CIRCUS PARADE,-12,12-01-2010 10:24,1.65,17548,United Kingdom,1,1112354
C536391,21984,PACK OF 12 PINK PAISLEY TISSUES,-24,12-01-2010 10:24,0.29,17548,United Kingdom,2,1094020
C536391,21983,PACK OF 12 BLUE PAISLEY TISSUES,-24,12-01-2010 10:24,0.29,17548,United Kingdom,2,1676901
C536391,21980,PACK OF 12 RED RETROSPOT TISSUES,-24,12-01-2010 10:24,0.29,17548,United Kingdom,1,1117629
C536391,21484,CHICK GREY HOT WATER BOTTLE,-12,12-01-2010 10:24,3.45,17548,United Kingdom,4,1293782
C536391,22557,PLASTERS IN TIN VINTAGE PAISLEY,-12,12-01-2010 10:24,1.65,17548,United Kingdom,3,1321249
C536391,22553,PLASTERS IN TIN SKULLS,-24,12-01-2010 10:24,1.65,17548,United Kingdom,4,1843011
536392,22150,3 STRIPEY MICE FELTCRAFT,6,12-01-2010 10:29,1.95,13705,United Kingdom,1,1294326
536392,22619,SET OF 6 SOLDIER SKITTLES,4,12-01-2010 10:29,3.75,13705,United Kingdom,3,1938887
536392,21891,TRADITIONAL WOODEN SKIPPING ROPE,12,12-01-2010 10:29,1.25,13705,United Kingdom,4,1159784
536392,21889,WOODEN BOX OF DOMINOES,12,12-01-2010 10:29,1.25,13705,United Kingdom,2,1081846
536392,22827,RUSTIC  SEVENTEEN DRAWER SIDEBOARD,1,12-01-2010 10:29,165,13705,United Kingdom,5,1707861
536392,22127,PARTY CONES CARNIVAL ASSORTED,12,12-01-2010 10:29,1.25,13705,United Kingdom,3,1343437
536392,22128,PARTY CONES CANDY ASSORTED,12,12-01-2010 10:29,1.25,13705,United Kingdom,1,1301587
536392,22502,PICNIC BASKET WICKER SMALL,4,12-01-2010 10:29,5.95,13705,United Kingdom,3,1218020
536392,84879,ASSORTED COLOUR BIRD ORNAMENT,16,12-01-2010 10:29,1.69,13705,United Kingdom,4,1555986
536392,22338,STAR DECORATION PAINTED ZINC,24,12-01-2010 10:29,0.65,13705,United Kingdom,2,1618844
536393,22180,RETROSPOT LAMP,8,12-01-2010 10:37,9.95,13747,United Kingdom,3,1750897
536394,21506,"FANCY FONT BIRTHDAY CARD, ",24,12-01-2010 10:39,0.42,13408,United Kingdom,2,1731157
536394,22633,HAND WARMER UNION JACK,96,12-01-2010 10:39,1.85,13408,United Kingdom,5,1724158
536394,22866,HAND WARMER SCOTTY DOG DESIGN,96,12-01-2010 10:39,1.85,13408,United Kingdom,2,1237719
536394,22865,HAND WARMER OWL DESIGN,96,12-01-2010 10:39,1.85,13408,United Kingdom,1,1167153
536394,22632,HAND WARMER RED RETROSPOT,96,12-01-2010 10:39,1.85,13408,United Kingdom,4,1557329
536394,21485,RETROSPOT HEART HOT WATER BOTTLE,12,12-01-2010 10:39,4.95,13408,United Kingdom,1,1071195
536394,22349,DOG BOWL CHASING BALL DESIGN,12,12-01-2010 10:39,3.75,13408,United Kingdom,3,1267817
536394,22558,CLOTHES PEGS RETROSPOT PACK 24,48,12-01-2010 10:39,1.25,13408,United Kingdom,2,1766665
536394,85152,HAND OVER THE CHOCOLATE   SIGN,12,12-01-2010 10:39,2.1,13408,United Kingdom,2,1982538
536394,85123A,WHITE HANGING HEART T-LIGHT HOLDER,32,12-01-2010 10:39,2.55,13408,United Kingdom,4,1976299
536394,22652,TRAVEL SEWING KIT,20,12-01-2010 10:39,1.65,13408,United Kingdom,5,1102874
536395,22188,BLACK HEART CARD HOLDER,8,12-01-2010 10:47,3.95,13767,United Kingdom,1,1441392
536395,84879,ASSORTED COLOUR BIRD ORNAMENT,32,12-01-2010 10:47,1.69,13767,United Kingdom,4,1146189
536395,21977,PACK OF 60 PINK PAISLEY CAKE CASES,24,12-01-2010 10:47,0.55,13767,United Kingdom,1,1550395
536395,84991,60 TEATIME FAIRY CAKE CASES,24,12-01-2010 10:47,0.55,13767,United Kingdom,4,1644347
536395,21212,PACK OF 72 RETROSPOT CAKE CASES,24,12-01-2010 10:47,0.55,13767,United Kingdom,2,1531530
