InvoiceNo,StockCode,Description,Quantity,InvoiceDate,UnitPrice,customer_id,Country,review_score,product_id
536813,72816,SET/3 CHRISTMAS DECOUPAGE CANDLES,12,12-02-2010 16:59,1.25,15646,United Kingdom,5,1884122
536813,35957,SMALLFOLKART BAUBLE CHRISTMAS DEC,48,12-02-2010 16:59,0.42,15646,United Kingdom,5,1254645
536813,17003,BROCADE RING PURSE,36,12-02-2010 16:59,0.21,15646,United Kingdom,3,1314744
536813,22089,PAPER BUNTING VINTAGE PAISLEY,6,12-02-2010 16:59,2.95,15646,United Kingdom,3,1989368
536813,22413,METAL SIGN TAKE IT OR LEAVE IT,6,12-02-2010 16:59,2.95,15646,United Kingdom,1,1543388
536813,46000S,POLYESTER FILLER PAD 40x40cm,2,12-02-2010 16:59,1.45,15646,United Kingdom,2,1553623
C536814,21527,RED RETROSPOT TRADITIONAL TEAPOT,-2,12-02-2010 17:03,7.95,13958,United Kingdom,1,1538466
C536814,72799E,IVORY PILLAR CANDLE SILVER FLOCK,-6,12-02-2010 17:03,2.95,13958,United Kingdom,3,1077033
C536814,85066,CREAM SWEETHEART MINI CHEST,-2,12-02-2010 17:03,12.75,13958,United Kingdom,5,1800904
C536814,21586,KINGS CHOICE GIANT TUBE MATCHES,-12,12-02-2010 17:03,2.55,13958,United Kingdom,4,1744999
C536814,21258,VICTORIAN SEWING BOX LARGE,-1,12-02-2010 17:03,12.75,13958,United Kingdom,4,1329534
C536815,85175,CACTI T-LIGHT CANDLES,-1,12-02-2010 17:05,0.42,14443,United Kingdom,3,1927286
C536815,22178,VICTORIAN GLASS HANGING T-LIGHT,-1,12-02-2010 17:05,1.25,14443,United Kingdom,2,1832631
C536816,21129,SILVER FISHING GNOME,-2,12-02-2010 17:06,6.95,14443,United Kingdom,4,1508051
C536817,22187,GREEN CHRISTMAS TREE CARD HOLDER,-1,12-02-2010 17:08,4.25,14156,EIRE,4,1736093
C536817,71477,COLOUR GLASS. STAR T-LIGHT HOLDER,-1,12-02-2010 17:08,3.25,14156,EIRE,5,1974795
C536818,84947,ANTIQUE SILVER TEA GLASS ENGRAVED,-1,12-02-2010 17:09,1.25,16995,United Kingdom,3,1215920
536819,22427,ENAMEL FLOWER JUG CREAM,3,12-02-2010 17:12,5.95,13402,United Kingdom,3,1491427
536819,72741,GRAND CHOCOLATECANDLE,9,12-02-2010 17:12,1.45,13402,United Kingdom,5,1856919
536819,22898,CHILDRENS APRON APPLES DESIGN,8,12-02-2010 17:12,1.95,13402,United Kingdom,2,1573228
536819,22667,RECIPE BOX RETROSPOT,6,12-02-2010 17:12,2.95,13402,United Kingdom,2,1811080
536819,22328,ROUND SNACK BOXES SET OF 4 FRUITS,12,12-02-2010 17:12,2.95,13402,United Kingdom,5,1619476
536819,21506,"FANCY FONT BIRTHDAY CARD, ",12,12-02-2010 17:12,0.42,13402,United Kingdom,5,1651219
536819,21519,GIN & TONIC DIET GREETING CARD,12,12-02-2010 17:12,0.42,13402,United Kingdom,4,1041648
536819,21213,PACK OF 72 SKULL CAKE CASES,24,12-02-2010 17:12,0.55,13402,United Kingdom,3,1844652
536819,21063,PARTY INVITES JAZZ HEARTS,12,12-02-2010 17:12,0.85,13402,United Kingdom,4,1977922
536819,21059,PARTY INVITES DINOSAURS,12,12-02-2010 17:12,0.85,13402,United Kingdom,2,1717433
536819,84375,SET OF 20 KIDS COOKIE CUTTERS,24,12-02-2010 17:12,2.1,13402,United Kingdom,5,1113332
536819,22625,RED KITCHEN SCALES,2,12-02-2010 17:12,8.5,13402,United Kingdom,2,1454827
536819,22624,IVORY KITCHEN SCALES,2,12-02-2010 17:12,8.5,13402,United Kingdom,3,1262212
536819,22988,SOLDIERS EGG CUP,12,12-02-2010 17:12,1.25,13402,United Kingdom,3,1553890
536819,21975,PACK OF 60 DINOSAUR CAKE CASES,24,12-02-2010 17:12,0.55,13402,United Kingdom,1,1526672
536819,20914,SET/5 RED RETROSPOT LID GLASS BOWLS,12,12-02-2010 17:12,2.95,13402,United Kingdom,1,1878323
536819,22429,ENAMEL MEASURING JUG CREAM,4,12-02-2010 17:12,4.25,13402,United Kingdom,4,1761074
C536820,22877,NUMBER TILE COTTAGE GARDEN 9,-1,12-02-2010 17:14,1.95,18168,United Kingdom,4,1186244
C536820,22869,NUMBER TILE COTTAGE GARDEN 1,-1,12-02-2010 17:14,1.95,18168,United Kingdom,3,1065191
C536820,22878,NUMBER TILE COTTAGE GARDEN No,-1,12-02-2010 17:14,2.1,18168,United Kingdom,4,1533293
C536820,21843,RED RETROSPOT CAKE STAND,-1,12-02-2010 17:14,10.95,18168,United Kingdom,5,1243368
536821,22630,DOLLY GIRL LUNCH BOX,1,12-02-2010 17:17,1.95,17757,United Kingdom,2,1074912
536821,22867,HAND WARMER BIRD DESIGN,1,12-02-2010 17:17,2.1,17757,United Kingdom,3,1827350
536821,21494,ROTATING LEAVES T-LIGHT HOLDER,3,12-02-2010 17:17,1.25,17757,United Kingdom,3,1484255
536821,21094,SET/6 RED SPOTTY PAPER PLATES,6,12-02-2010 17:17,0.85,17757,United Kingdom,3,1918075
536821,22651,GENTLEMAN SHIRT REPAIR KIT,7,12-02-2010 17:17,0.85,17757,United Kingdom,5,1900337
536821,21080,SET/20 RED RETROSPOT PAPER NAPKINS,3,12-02-2010 17:17,0.85,17757,United Kingdom,4,1886689
536821,22652,TRAVEL SEWING KIT,1,12-02-2010 17:17,1.65,17757,United Kingdom,4,1162710
536821,21217,RED RETROSPOT ROUND CAKE TINS,1,12-02-2010 17:17,9.95,17757,United Kingdom,5,1845229
536821,22502,PICNIC BASKET WICKER SMALL,3,12-02-2010 17:17,5.95,17757,United Kingdom,1,1164692
536821,22430,ENAMEL WATERING CAN CREAM,1,12-02-2010 17:17,4.95,17757,United Kingdom,3,1788996
536821,21429,RED GINGHAM ROSE JEWELLERY BOX,1,12-02-2010 17:17,1.65,17757,United Kingdom,2,1761119
536821,22666,RECIPE BOX PANTRY YELLOW DESIGN,4,12-02-2010 17:17,2.95,17757,United Kingdom,2,1789932
536821,22667,RECIPE BOX RETROSPOT,4,12-02-2010 17:17,2.95,17757,United Kingdom,5,1545757
536821,21034,REX CASH+CARRY JUMBO SHOPPER,2,12-02-2010 17:17,0.95,17757,United Kingdom,3,1525574
536821,22425,ENAMEL COLANDER CREAM,2,12-02-2010 17:17,4.95,17757,United Kingdom,3,1418022
536821,21086,SET/6 RED SPOTTY PAPER CUPS,6,12-02-2010 17:17,0.65,17757,United Kingdom,3,1532011
536821,21240,BLUE POLKADOT CUP,8,12-02-2010 17:17,0.85,17757,United Kingdom,1,1591926
536821,21239,PINK  POLKADOT CUP,8,12-02-2010 17:17,0.85,17757,United Kingdom,2,1720297
536821,21238,RED RETROSPOT CUP,5,12-02-2010 17:17,0.85,17757,United Kingdom,4,1168613
536821,22617,BAKING SET SPACEBOY DESIGN,1,12-02-2010 17:17,4.95,17757,United Kingdom,1,1070708
536821,22083,PAPER CHAIN KIT RETROSPOT,6,12-02-2010 17:17,2.95,17757,United Kingdom,4,1657009
536821,22197,SMALL POPCORN HOLDER,5,12-02-2010 17:17,0.85,17757,United Kingdom,3,1773050
536821,22631,CIRCUS PARADE LUNCH BOX,1,12-02-2010 17:17,1.95,17757,United Kingdom,3,1647719
C536822,22847,BREAD BIN DINER STYLE IVORY,-2,12-02-2010 17:19,16.95,14625,United Kingdom,5,1996769
C536822,21430,SET/3 RED GINGHAM ROSE STORAGE BOX,-1,12-02-2010 17:19,3.75,14625,United Kingdom,1,1939179
536823,22508,DOORSTOP RETROSPOT HEART,4,12-02-2010 17:22,3.75,13011,United Kingdom,4,1613266
536823,82494L,WOODEN FRAME ANTIQUE WHITE,6,12-02-2010 17:22,2.95,13011,United Kingdom,4,1701095
536823,85014A,BLACK/BLUE POLKADOT UMBRELLA,3,12-02-2010 17:22,5.95,13011,United Kingdom,3,1543535
536824,85123A,WHITE HANGING HEART T-LIGHT HOLDER,160,12-02-2010 17:24,2.55,13798,United Kingdom,3,1110580
C536825,22617,BAKING SET SPACEBOY DESIGN,-1,12-02-2010 17:27,4.95,15384,United Kingdom,3,1534660
C536825,22197,SMALL POPCORN HOLDER,-2,12-02-2010 17:27,0.85,15384,United Kingdom,3,1386157
C536826,35004B,SET OF 3 BLACK FLYING DUCKS,-2,12-02-2010 17:30,4.65,17924,United Kingdom,3,1474220
C536826,35004B,SET OF 3 BLACK FLYING DUCKS,-3,12-02-2010 17:30,4.65,17924,United Kingdom,4,1302385
C536827,21527,RED RETROSPOT TRADITIONAL TEAPOT,-3,12-02-2010 17:31,6.95,13408,United Kingdom,5,1305886
C536828,22832,BROCANTE SHELF WITH HOOKS,-1,12-02-2010 17:35,10.75,14264,United Kingdom,4,1324705
C536828,84946,ANTIQUE SILVER TEA GLASS ETCHED,-3,12-02-2010 17:35,1.25,14264,United Kingdom,2,1014204
C536829,71477,COLOUR GLASS. STAR T-LIGHT HOLDER,-1,12-02-2010 17:36,3.25,13295,United Kingdom,2,1144668
536830,84077,WORLD WAR 2 GLIDERS ASSTD DESIGNS,2880,12-02-2010 17:38,0.18,16754,United Kingdom,2,1381752
536830,21915,RED  HARMONICA IN BOX,1400,12-02-2010 17:38,1.06,16754,United Kingdom,2,1007870
536831,84880,WHITE WIRE EGG HOLDER,12,12-02-2010 17:40,4.95,16029,United Kingdom,2,1495300
536831,22207,FRYING PAN UNION FLAG,48,12-02-2010 17:40,3.75,16029,United Kingdom,1,1151298
536831,21929,JUMBO BAG PINK VINTAGE PAISLEY,100,12-02-2010 17:40,1.65,16029,United Kingdom,1,1575715
536831,21928,JUMBO BAG SCANDINAVIAN PAISLEY,100,12-02-2010 17:40,1.65,16029,United Kingdom,2,1447513
536832,21927,BLUE/CREAM STRIPE CUSHION COVER,24,12-02-2010 17:41,1.25,16634,United Kingdom,1,1243114
536832,21925,UNION STRIPE CUSHION COVER,12,12-02-2010 17:41,1.25,16634,United Kingdom,5,1987108
536832,71477,COLOUR GLASS. STAR T-LIGHT HOLDER,4,12-02-2010 17:41,3.25,16634,United Kingdom,3,1996807
536832,21733,RED HANGING HEART T-LIGHT HOLDER,6,12-02-2010 17:41,2.95,16634,United Kingdom,1,1518425
536832,22763,KEY CABINET MA CAMPAGNE,2,12-02-2010 17:41,9.95,16634,United Kingdom,4,1509190
536832,22863,SOAP DISH BROCANTE,6,12-02-2010 17:41,2.95,16634,United Kingdom,2,1057913
536832,84406B,CREAM CUPID HEARTS COAT HANGER,8,12-02-2010 17:41,3.25,16634,United Kingdom,5,1402749
536832,85066,CREAM SWEETHEART MINI CHEST,2,12-02-2010 17:41,12.75,16634,United Kingdom,2,1442209
536833,85123A,WHITE HANGING HEART T-LIGHT HOLDER,6,12-02-2010 17:48,2.95,18239,United Kingdom,3,1926342
536833,84970S,HANGING HEART ZINC T-LIGHT HOLDER,12,12-02-2010 17:48,0.85,18239,United Kingdom,5,1423556
536833,20749,ASSORTED COLOUR MINI CASES,2,12-02-2010 17:48,7.95,18239,United Kingdom,5,1375899
536833,15060B,FAIRY CAKE DESIGN UMBRELLA,4,12-02-2010 17:48,3.75,18239,United Kingdom,2,1126336
536833,85014B,RED RETROSPOT UMBRELLA,3,12-02-2010 17:48,5.95,18239,United Kingdom,2,1048629
536833,22464,HANGING METAL HEART LANTERN,12,12-02-2010 17:48,1.65,18239,United Kingdom,3,1249914
536833,22465,HANGING METAL STAR LANTERN,12,12-02-2010 17:48,1.65,18239,United Kingdom,1,1889814
536833,22785,SQUARECUSHION COVER PINK UNION FLAG,4,12-02-2010 17:48,6.75,18239,United Kingdom,2,1490882
536833,71053,WHITE METAL LANTERN,4,12-02-2010 17:48,3.75,18239,United Kingdom,3,1026637
536833,22969,HOMEMADE JAM SCENTED CANDLES,12,12-02-2010 17:48,1.45,18239,United Kingdom,5,1887953
536833,22810,SET OF 6 T-LIGHTS SNOWMEN,6,12-02-2010 17:48,2.95,18239,United Kingdom,5,1901589
536833,22186,RED STAR CARD HOLDER,6,12-02-2010 17:48,2.95,18239,United Kingdom,3,1490591
536833,22187,GREEN CHRISTMAS TREE CARD HOLDER,4,12-02-2010 17:48,4.25,18239,United Kingdom,3,1364286
536833,22141,CHRISTMAS CRAFT TREE TOP ANGEL,6,12-02-2010 17:48,2.1,18239,United Kingdom,1,1196155
536833,22144,CHRISTMAS CRAFT LITTLE FRIENDS,6,12-02-2010 17:48,2.1,18239,United Kingdom,5,1578769
536833,22121,NOEL WOODEN BLOCK LETTERS,3,12-02-2010 17:48,5.95,18239,United Kingdom,1,1271411
536833,21364,PEACE SMALL WOOD LETTERS,2,12-02-2010 17:48,6.75,18239,United Kingdom,2,1005107
536833,22573,STAR WOODEN CHRISTMAS DECORATION,12,12-02-2010 17:48,0.85,18239,United Kingdom,1,1907284
536833,22576,SWALLOW WOODEN CHRISTMAS DECORATION,12,12-02-2010 17:48,0.85,18239,United Kingdom,1,1649513
536833,22578,WOODEN STAR CHRISTMAS SCANDINAVIAN,12,12-02-2010 17:48,0.85,18239,United Kingdom,4,1788291
536833,22593,CHRISTMAS GINGHAM STAR,12,12-02-2010 17:48,0.85,18239,United Kingdom,1,1703957
536833,22595,CHRISTMAS GINGHAM HEART,12,12-02-2010 17:48,0.85,18239,United Kingdom,4,1681218
536833,35961,FOLKART ZINC HEART CHRISTMAS DEC,12,12-02-2010 17:48,0.85,18239,United Kingdom,1,1150809
536833,22334,DINOSAUR PARTY BAG + STICKER SET,8,12-02-2010 17:48,1.65,18239,United Kingdom,2,1255002
536833,22910,PAPER CHAIN KIT VINTAGE CHRISTMAS,6,12-02-2010 17:48,2.95,18239,United Kingdom,5,1754383
536833,22065,CHRISTMAS PUDDING TRINKET POT,12,12-02-2010 17:48,1.45,18239,United Kingdom,3,1982693
536833,21349,IVY HEART WREATH,2,12-02-2010 17:48,6.75,18239,United Kingdom,1,1541961
536833,21352,EUCALYPTUS & PINECONE  WREATH,2,12-02-2010 17:48,6.75,18239,United Kingdom,4,1996959
536833,21621,VINTAGE UNION JACK BUNTING,2,12-02-2010 17:48,8.5,18239,United Kingdom,1,1662384
536834,21111,"SWISS ROLL TOWEL, CHOCOLATE  SPOTS",12,12-02-2010 17:51,2.95,14576,United Kingdom,5,1076083
536835,22655,VINTAGE RED KITCHEN CABINET,1,12-02-2010 18:06,295,13145,United Kingdom,3,1749137
536836,21231,SWEETHEART CERAMIC TRINKET BOX,20,12-02-2010 18:08,1.25,18168,United Kingdom,5,1634396
536836,21232,STRAWBERRY CERAMIC TRINKET BOX,20,12-02-2010 18:08,1.25,18168,United Kingdom,5,1284034
536836,22060,LARGE CAKE STAND HANGING HEARTS,2,12-02-2010 18:08,9.95,18168,United Kingdom,5,1238960
536836,37449,CERAMIC CAKE STAND + HANGING CAKES,2,12-02-2010 18:08,9.95,18168,United Kingdom,2,1211721
536836,22061,LARGE CAKE STAND  HANGING STRAWBERY,2,12-02-2010 18:08,9.95,18168,United Kingdom,5,1036042
536836,21843,RED RETROSPOT CAKE STAND,2,12-02-2010 18:08,10.95,18168,United Kingdom,4,1277479
536836,21531,RED RETROSPOT SUGAR JAM BOWL,2,12-02-2010 18:08,2.55,18168,United Kingdom,4,1761929
536836,21539,RED RETROSPOT BUTTER DISH,3,12-02-2010 18:08,4.95,18168,United Kingdom,4,1412294
536836,22198,LARGE POPCORN HOLDER,2,12-02-2010 18:08,1.65,18168,United Kingdom,1,1152292
536836,22197,SMALL POPCORN HOLDER,2,12-02-2010 18:08,0.85,18168,United Kingdom,1,1459042
536836,22633,HAND WARMER UNION JACK,4,12-02-2010 18:08,2.1,18168,United Kingdom,3,1424386
536836,22180,RETROSPOT LAMP,1,12-02-2010 18:08,9.95,18168,United Kingdom,2,1689467
536836,21218,RED SPOTTY BISCUIT TIN,2,12-02-2010 18:08,3.75,18168,United Kingdom,5,1662136
536836,21155,RED RETROSPOT PEG BAG,1,12-02-2010 18:08,2.1,18168,United Kingdom,2,1798722
536836,21039,RED RETROSPOT SHOPPING BAG,1,12-02-2010 18:08,2.55,18168,United Kingdom,3,1914098
536836,21157,RED RETROSPOT WASHBAG,1,12-02-2010 18:08,2.1,18168,United Kingdom,1,1356433
536836,21041,RED RETROSPOT OVEN GLOVE DOUBLE,1,12-02-2010 18:08,2.95,18168,United Kingdom,1,1349509
536836,21154,RED RETROSPOT OVEN GLOVE,1,12-02-2010 18:08,1.25,18168,United Kingdom,4,1342071
536836,21154,RED RETROSPOT OVEN GLOVE,2,12-02-2010 18:08,1.25,18168,United Kingdom,1,1093105
536836,21035,SET/2 RED RETROSPOT TEA TOWELS,1,12-02-2010 18:08,2.95,18168,United Kingdom,4,1277976
536836,47570B,TEA TIME TABLE CLOTH,1,12-02-2010 18:08,10.65,18168,United Kingdom,3,1262454
536836,47567B,TEA TIME KITCHEN APRON,2,12-02-2010 18:08,5.95,18168,United Kingdom,2,1303516
536836,47559B,TEA TIME OVEN GLOVE,6,12-02-2010 18:08,1.25,18168,United Kingdom,5,1103274
536836,22193,RED DINER WALL CLOCK,1,12-02-2010 18:08,8.5,18168,United Kingdom,1,1094803
536836,22649,STRAWBERRY FAIRY CAKE TEAPOT,1,12-02-2010 18:08,4.95,18168,United Kingdom,1,1002403
536836,16156S,WRAP PINK FAIRY CAKES,25,12-02-2010 18:08,0.42,18168,United Kingdom,3,1940360
536836,16161P,WRAP ENGLISH ROSE,25,12-02-2010 18:08,0.42,18168,United Kingdom,4,1051872
536837,82486,WOOD S/3 CABINET ANT WHITE FINISH,2,12-02-2010 18:15,7.95,14395,United Kingdom,5,1226465
536837,82483,WOOD 2 DRAWER CABINET WHITE FINISH,4,12-02-2010 18:15,5.95,14395,United Kingdom,1,1941099
536837,82482,WOODEN PICTURE FRAME WHITE FINISH,6,12-02-2010 18:15,2.55,14395,United Kingdom,2,1587299
536837,21754,HOME BUILDING BLOCK WORD,3,12-02-2010 18:15,5.95,14395,United Kingdom,4,1420884
536837,21755,LOVE BUILDING BLOCK WORD,3,12-02-2010 18:15,5.95,14395,United Kingdom,3,1632745
536837,82494L,WOODEN FRAME ANTIQUE WHITE,4,12-02-2010 18:15,2.95,14395,United Kingdom,3,1769113
536837,22171,3 HOOK PHOTO SHELF ANTIQUE WHITE,2,12-02-2010 18:15,8.5,14395,United Kingdom,3,1407982
536837,16161M,WRAP  PINK FLOCK,25,12-02-2010 18:15,0.42,14395,United Kingdom,3,1403339
536837,22112,CHOCOLATE HOT WATER BOTTLE,7,12-02-2010 18:15,4.95,14395,United Kingdom,2,1068301
536837,21980,PACK OF 12 RED RETROSPOT TISSUES,12,12-02-2010 18:15,0.29,14395,United Kingdom,4,1542634
536837,21486,PINK HEART DOTS HOT WATER BOTTLE,3,12-02-2010 18:15,3.75,14395,United Kingdom,5,1003165
536837,20972,PINK CREAM FELT CRAFT TRINKET BOX,6,12-02-2010 18:15,1.25,14395,United Kingdom,4,1085755
536837,22114,HOT WATER BOTTLE TEA AND SYMPATHY,4,12-02-2010 18:15,3.95,14395,United Kingdom,1,1226451
536837,22144,CHRISTMAS CRAFT LITTLE FRIENDS,2,12-02-2010 18:15,2.1,14395,United Kingdom,5,1314105
536837,22865,HAND WARMER OWL DESIGN,1,12-02-2010 18:15,2.1,14395,United Kingdom,4,1004289
536837,22633,HAND WARMER UNION JACK,4,12-02-2010 18:15,2.1,14395,United Kingdom,1,1767860
536837,22470,HEART OF WICKER LARGE,3,12-02-2010 18:15,2.95,14395,United Kingdom,2,1735400
536837,22632,HAND WARMER RED RETROSPOT,4,12-02-2010 18:15,2.1,14395,United Kingdom,3,1507520
536837,85049A,TRADITIONAL CHRISTMAS RIBBONS,6,12-02-2010 18:15,1.25,14395,United Kingdom,5,1176799
536837,20984,12 PENCILS TALL TUBE POSY,5,12-02-2010 18:15,0.85,14395,United Kingdom,5,1739079
536837,85214,TUB 24 PINK FLOWER PEGS,1,12-02-2010 18:15,1.65,14395,United Kingdom,5,1443813
536837,22804,CANDLEHOLDER PINK HANGING HEART,2,12-02-2010 18:15,2.95,14395,United Kingdom,5,1430616
536837,20981,12 PENCILS TALL TUBE WOODLAND,5,12-02-2010 18:15,0.85,14395,United Kingdom,4,1359279
536837,22173,METAL 4 HOOK HANGER FRENCH CHATEAU,8,12-02-2010 18:15,2.95,14395,United Kingdom,1,1515858
536837,85123A,WHITE HANGING HEART T-LIGHT HOLDER,2,12-02-2010 18:15,2.95,14395,United Kingdom,5,1812568
536837,21499,BLUE POLKADOT WRAP,25,12-02-2010 18:15,0.42,14395,United Kingdom,2,1703913
536837,21500,PINK POLKADOT WRAP,25,12-02-2010 18:15,0.42,14395,United Kingdom,2,1772496
536838,15036,ASSORTED COLOURS SILK FAN,24,12-02-2010 18:23,0.75,14865,United Kingdom,4,1884687
536838,72232,FENG SHUI PILLAR CANDLE,48,12-02-2010 18:23,0.19,14865,United Kingdom,2,1515587
536838,40016,CHINESE DRAGON PAPER LANTERNS,24,12-02-2010 18:23,0.42,14865,United Kingdom,2,1930461
536839,84077,WORLD WAR 2 GLIDERS ASSTD DESIGNS,288,12-02-2010 18:25,0.21,15093,United Kingdom,1,1846703
536839,20685,DOORMAT RED RETROSPOT,5,12-02-2010 18:25,7.95,15093,United Kingdom,4,1092781
536839,21524,DOORMAT SPOTTY HOME SWEET HOME,10,12-02-2010 18:25,6.75,15093,United Kingdom,1,1545089
536839,21916,SET 12 RETRO WHITE CHALK STICKS,24,12-02-2010 18:25,0.42,15093,United Kingdom,2,1630390
536839,21508,VINTAGE KID DOLLY CARD,12,12-02-2010 18:25,0.42,15093,United Kingdom,5,1736045
536839,22027,TEA PARTY BIRTHDAY CARD,12,12-02-2010 18:25,0.42,15093,United Kingdom,5,1181693
536839,22030,SWALLOWS GREETING CARD,36,12-02-2010 18:25,0.42,15093,United Kingdom,5,1215208
536839,22029,SPACEBOY BIRTHDAY CARD,36,12-02-2010 18:25,0.42,15093,United Kingdom,3,1320786
536839,21519,GIN & TONIC DIET GREETING CARD,36,12-02-2010 18:25,0.42,15093,United Kingdom,4,1115683
536839,21506,"FANCY FONT BIRTHDAY CARD, ",24,12-02-2010 18:25,0.42,15093,United Kingdom,4,1768683
536839,22023,EMPIRE BIRTHDAY CARD,24,12-02-2010 18:25,0.42,15093,United Kingdom,4,1462813
536839,21507,"ELEPHANT, BIRTHDAY CARD, ",36,12-02-2010 18:25,0.42,15093,United Kingdom,3,1634103
536839,84247G,"DECOUPAGE,GREETING CARD,",48,12-02-2010 18:25,0.42,15093,United Kingdom,5,1690267
536839,21509,COWBOYS AND INDIANS BIRTHDAY CARD,48,12-02-2010 18:25,0.42,15093,United Kingdom,5,1546520
536839,84879,ASSORTED COLOUR BIRD ORNAMENT,96,12-02-2010 18:25,1.69,15093,United Kingdom,3,1755493
536839,22585,PACK OF 6 BIRDY GIFT TAGS,144,12-02-2010 18:25,1.06,15093,United Kingdom,2,1537277
536840,22961,JAM MAKING SET PRINTED,12,12-02-2010 18:27,1.45,12738,Germany,3,1081611
536840,22962,JAM JAR WITH PINK LID,12,12-02-2010 18:27,0.85,12738,Germany,1,1394445
536840,22963,JAM JAR WITH GREEN LID,12,12-02-2010 18:27,0.85,12738,Germany,4,1734057
536840,22776,SWEETHEART CAKESTAND 3 TIER,1,12-02-2010 18:27,9.95,12738,Germany,1,1038915
536840,22952,60 CAKE CASES VINTAGE CHRISTMAS,24,12-02-2010 18:27,0.55,12738,Germany,4,1408982
536840,22077,6 RIBBONS RUSTIC CHARM,12,12-02-2010 18:27,1.65,12738,Germany,3,1271335
536840,22215,CAKE STAND WHITE TWO TIER LACE,2,12-02-2010 18:27,8.5,12738,Germany,5,1440541
536840,21977,PACK OF 60 PINK PAISLEY CAKE CASES,24,12-02-2010 18:27,0.55,12738,Germany,2,1253345
536840,84991,60 TEATIME FAIRY CAKE CASES,24,12-02-2010 18:27,0.55,12738,Germany,5,1927125
536840,21212,PACK OF 72 RETROSPOT CAKE CASES,24,12-02-2010 18:27,0.55,12738,Germany,4,1996701
536840,POST,POSTAGE,1,12-02-2010 18:27,18,12738,Germany,1,1612574
536841,22766,PHOTO FRAME CORNICE,8,12-02-2010 18:27,2.95,16150,United Kingdom,4,1328037
536841,22768,FAMILY PHOTO FRAME CORNICE,4,12-02-2010 18:27,9.95,16150,United Kingdom,2,1545182
536841,21260,FIRST AID TIN,6,12-02-2010 18:27,3.25,16150,United Kingdom,5,1615953
536841,22169,FAMILY ALBUM WHITE PICTURE FRAME,2,12-02-2010 18:27,8.5,16150,United Kingdom,2,1061105
536841,84879,ASSORTED COLOUR BIRD ORNAMENT,8,12-02-2010 18:27,1.69,16150,United Kingdom,2,1534845
536841,22171,3 HOOK PHOTO SHELF ANTIQUE WHITE,2,12-02-2010 18:27,8.5,16150,United Kingdom,3,1913928
536841,22170,PICTURE FRAME WOOD TRIPLE PORTRAIT,4,12-02-2010 18:27,6.75,16150,United Kingdom,1,1293458
536841,22470,HEART OF WICKER LARGE,6,12-02-2010 18:27,2.95,16150,United Kingdom,3,1590888
536841,22469,HEART OF WICKER SMALL,12,12-02-2010 18:27,1.65,16150,United Kingdom,2,1775699
536841,22969,HOMEMADE JAM SCENTED CANDLES,12,12-02-2010 18:27,1.45,16150,United Kingdom,5,1039203
536841,22771,CLEAR DRAWER KNOB ACRYLIC EDWARDIAN,12,12-02-2010 18:27,1.25,16150,United Kingdom,1,1580202
536841,22772,PINK DRAWER KNOB ACRYLIC EDWARDIAN,12,12-02-2010 18:27,1.25,16150,United Kingdom,5,1271704
536841,22775,PURPLE DRAWERKNOB ACRYLIC EDWARDIAN,12,12-02-2010 18:27,1.25,16150,United Kingdom,4,1859841
536841,21428,SET3 BOOK BOX GREEN GINGHAM FLOWER,4,12-02-2010 18:27,4.25,16150,United Kingdom,3,1056259
536841,21429,RED GINGHAM ROSE JEWELLERY BOX,8,12-02-2010 18:27,1.65,16150,United Kingdom,1,1462479
536841,21430,SET/3 RED GINGHAM ROSE STORAGE BOX,4,12-02-2010 18:27,3.75,16150,United Kingdom,5,1123265
536841,22077,6 RIBBONS RUSTIC CHARM,12,12-02-2010 18:27,1.65,16150,United Kingdom,3,1172390
536841,22356,CHARLOTTE BAG PINK POLKADOT,10,12-02-2010 18:27,0.85,16150,United Kingdom,1,1882670
536841,20724,RED RETROSPOT CHARLOTTE BAG,10,12-02-2010 18:27,0.85,16150,United Kingdom,2,1813816
536841,22759,SET OF 3 NOTEBOOKS IN PARCEL,12,12-02-2010 18:27,1.65,16150,United Kingdom,1,1437777
536841,21143,ANTIQUE GLASS HEART DECORATION,12,12-02-2010 18:27,1.95,16150,United Kingdom,3,1772951
536841,85064,CREAM SWEETHEART LETTER RACK,2,12-02-2010 18:27,5.45,16150,United Kingdom,2,1956759
536842,20726,LUNCH BAG WOODLAND,10,12-02-2010 18:45,1.65,17552,United Kingdom,3,1744433
536842,20977,36 PENCILS TUBE WOODLAND,16,12-02-2010 18:45,1.25,17552,United Kingdom,4,1031615
536842,22623,BOX OF VINTAGE JIGSAW BLOCKS,6,12-02-2010 18:45,4.95,17552,United Kingdom,4,1538199
536842,22617,BAKING SET SPACEBOY DESIGN,6,12-02-2010 18:45,4.95,17552,United Kingdom,2,1163991
536842,22502,PICNIC BASKET WICKER SMALL,4,12-02-2010 18:45,5.95,17552,United Kingdom,3,1870859
536842,47590B,PINK HAPPY BIRTHDAY BUNTING,6,12-02-2010 18:45,5.45,17552,United Kingdom,1,1691143
536842,47590A,BLUE HAPPY BIRTHDAY BUNTING,6,12-02-2010 18:45,5.45,17552,United Kingdom,3,1693809
536842,21981,PACK OF 12 WOODLAND TISSUES,48,12-02-2010 18:45,0.29,17552,United Kingdom,3,1355536
536842,22584,PACK OF 6 PANNETONE GIFT BOXES,6,12-02-2010 18:45,2.55,17552,United Kingdom,1,1712862
536842,21033,JUMBO BAG CHARLIE AND LOLA TOYS,10,12-02-2010 18:45,2.95,17552,United Kingdom,4,1957586
536842,22551,PLASTERS IN TIN SPACEBOY,12,12-02-2010 18:45,1.65,17552,United Kingdom,2,1968779
536843,22966,GINGERBREAD MAN COOKIE CUTTER,12,12-02-2010 18:46,1.25,17552,United Kingdom,2,1571200
536843,22890,NOVELTY BISCUITS CAKE STAND 3 TIER,2,12-02-2010 18:46,9.95,17552,United Kingdom,1,1265735
536844,22502,PICNIC BASKET WICKER SMALL,32,12-02-2010 18:49,4.95,14236,United Kingdom,1,1182058
536844,21430,SET/3 RED GINGHAM ROSE STORAGE BOX,4,12-02-2010 18:49,3.75,14236,United Kingdom,3,1649173
536844,22841,ROUND CAKE TIN VINTAGE GREEN,2,12-02-2010 18:49,7.95,14236,United Kingdom,1,1193223
536845,84997B,RED 3 PIECE RETROSPOT CUTLERY SET,1,12-02-2010 19:18,3.75,17961,United Kingdom,1,1292979
536845,22384,LUNCH BAG PINK POLKADOT,1,12-02-2010 19:18,1.65,17961,United Kingdom,4,1474147
536845,21530,DAIRY MAID TOASTRACK,1,12-02-2010 19:18,2.95,17961,United Kingdom,4,1008475
536845,21528,DAIRY MAID TRADITIONAL TEAPOT,1,12-02-2010 19:18,6.95,17961,United Kingdom,3,1777902
536845,22635,CHILDS BREAKFAST SET DOLLY GIRL,1,12-02-2010 19:18,9.95,17961,United Kingdom,5,1037796
536845,21326,AGED GLASS SILVER T-LIGHT HOLDER,6,12-02-2010 19:18,0.65,17961,United Kingdom,4,1766154
536845,84832,ZINC WILLIE WINKIE  CANDLE STICK,4,12-02-2010 19:18,0.85,17961,United Kingdom,4,1948206
536845,21891,TRADITIONAL WOODEN SKIPPING ROPE,1,12-02-2010 19:18,1.25,17961,United Kingdom,1,1238775
536845,72807C,SET/3 VANILLA SCENTED CANDLE IN BOX,1,12-02-2010 19:18,4.25,17961,United Kingdom,1,1861352
536845,21333,CLASSIC WHITE FRAME,1,12-02-2010 19:18,2.95,17961,United Kingdom,2,1719948
536845,21820,GLITTER HEART GARLAND WITH BELLS,1,12-02-2010 19:18,3.75,17961,United Kingdom,5,1195147
536845,21821,GLITTER STAR GARLAND WITH BELLS,1,12-02-2010 19:18,3.75,17961,United Kingdom,3,1388130
536845,22162,HEART GARLAND RUSTIC PADDED,1,12-02-2010 19:18,2.95,17961,United Kingdom,5,1781591
536845,20727,LUNCH BAG  BLACK SKULL.,1,12-02-2010 19:18,1.65,17961,United Kingdom,2,1614518
536845,22619,SET OF 6 SOLDIER SKITTLES,2,12-02-2010 19:18,3.75,17961,United Kingdom,1,1070464
536845,21479,WHITE SKULL HOT WATER BOTTLE,1,12-02-2010 19:18,3.75,17961,United Kingdom,5,1582814
536845,84029G,KNITTED UNION FLAG HOT WATER BOTTLE,1,12-02-2010 19:18,3.75,17961,United Kingdom,1,1008470
536845,21706,FOLDING UMBRELLA RED/WHITE POLKADOT,1,12-02-2010 19:18,4.95,17961,United Kingdom,3,1669708
536845,21114,LAVENDER SCENTED FABRIC HEART,1,12-02-2010 19:18,1.25,17961,United Kingdom,2,1671209
536845,20725,LUNCH BAG RED RETROSPOT,1,12-02-2010 19:18,1.65,17961,United Kingdom,4,1365876
536845,22327,ROUND SNACK BOXES SET OF 4 SKULLS,1,12-02-2010 19:18,2.95,17961,United Kingdom,4,1349776
536845,20978,36 PENCILS TUBE SKULLS,3,12-02-2010 19:18,1.25,17961,United Kingdom,3,1485228
536845,20979,36 PENCILS TUBE RED RETROSPOT,4,12-02-2010 19:18,1.25,17961,United Kingdom,2,1286130
536845,22636,CHILDS BREAKFAST SET CIRCUS PARADE,1,12-02-2010 19:18,8.5,17961,United Kingdom,1,1547296
