InvoiceNo,StockCode,Description,Quantity,InvoiceDate,UnitPrice,customer_id,Country,review_score,product_id
537034,22466,FAIRY TALE COTTAGE NIGHTLIGHT,12,12-03-2010 17:20,1.95,13081,United Kingdom,1,1604009
537034,21726,MULTI HEARTS  STICKERS,12,12-03-2010 17:20,0.85,13081,United Kingdom,3,1253204
537034,21211,SET OF 72 SKULL PAPER  DOILIES,12,12-03-2010 17:20,1.45,13081,United Kingdom,1,1299957
537034,84029E,RED WOOLLY HOTTIE WHITE HEART.,12,12-03-2010 17:20,3.75,13081,United Kingdom,5,1134193
537034,84375,SET OF 20 KIDS COOKIE CUTTERS,12,12-03-2010 17:20,2.1,13081,United Kingdom,2,1384648
537034,21125,SET 6 FOOTBALL CELEBRATION CANDLES,12,12-03-2010 17:20,1.25,13081,United Kingdom,1,1875137
537034,21164,HOME SWEET HOME METAL SIGN,12,12-03-2010 17:20,2.95,13081,United Kingdom,3,1542799
537034,21877,HOME SWEET HOME MUG,12,12-03-2010 17:20,1.25,13081,United Kingdom,3,1778437
537034,22111,SCOTTIE DOG HOT WATER BOTTLE,12,12-03-2010 17:20,4.95,13081,United Kingdom,4,1409527
537034,22434,BALLOON PUMP WITH 10 BALLOONS,8,12-03-2010 17:20,1.95,13081,United Kingdom,3,1062377
537034,21724,PANDA AND BUNNIES STICKER SHEET,12,12-03-2010 17:20,0.85,13081,United Kingdom,1,1764071
537034,21429,RED GINGHAM ROSE JEWELLERY BOX,8,12-03-2010 17:20,1.65,13081,United Kingdom,3,1952111
537034,22569,FELTCRAFT CUSHION BUTTERFLY,12,12-03-2010 17:20,3.75,13081,United Kingdom,3,1770468
537034,84030E,ENGLISH ROSE HOT WATER BOTTLE,12,12-03-2010 17:20,4.25,13081,United Kingdom,3,1628459
537034,22837,HOT WATER BOTTLE BABUSHKA,12,12-03-2010 17:20,4.65,13081,United Kingdom,1,1744530
537034,22142,CHRISTMAS CRAFT WHITE FAIRY,12,12-03-2010 17:20,1.45,13081,United Kingdom,1,1982816
537034,22748,POPPY'S PLAYHOUSE KITCHEN,6,12-03-2010 17:20,2.1,13081,United Kingdom,3,1147886
537034,22780,LIGHT GARLAND BUTTERFILES PINK,8,12-03-2010 17:20,4.25,13081,United Kingdom,2,1221672
537034,22940,FELTCRAFT CHRISTMAS FAIRY,12,12-03-2010 17:20,4.25,13081,United Kingdom,4,1308245
537034,22198,LARGE POPCORN HOLDER,12,12-03-2010 17:20,1.65,13081,United Kingdom,5,1072143
537034,22745,POPPY'S PLAYHOUSE BEDROOM,6,12-03-2010 17:20,2.1,13081,United Kingdom,5,1768716
537034,22746,POPPY'S PLAYHOUSE LIVINGROOM,6,12-03-2010 17:20,2.1,13081,United Kingdom,4,1133948
537034,22747,POPPY'S PLAYHOUSE BATHROOM,6,12-03-2010 17:20,2.1,13081,United Kingdom,2,1409414
537034,20676,RED RETROSPOT BOWL,8,12-03-2010 17:20,1.25,13081,United Kingdom,1,1605390
537034,21243,PINK  POLKADOT PLATE,8,12-03-2010 17:20,1.69,13081,United Kingdom,5,1246307
537034,84997D,PINK 3 PIECE POLKADOT CUTLERY SET,6,12-03-2010 17:20,3.75,13081,United Kingdom,2,1560853
537034,22432,WATERING CAN PINK BUNNY,6,12-03-2010 17:20,1.95,13081,United Kingdom,3,1482943
537034,15060B,FAIRY CAKE DESIGN UMBRELLA,4,12-03-2010 17:20,3.75,13081,United Kingdom,5,1383186
537034,22327,ROUND SNACK BOXES SET OF 4 SKULLS,6,12-03-2010 17:20,2.95,13081,United Kingdom,5,1311233
537034,21481,FAWN BLUE HOT WATER BOTTLE,12,12-03-2010 17:20,2.95,13081,United Kingdom,4,1142231
537034,22314,OFFICE MUG WARMER CHOC+BLUE,6,12-03-2010 17:20,2.95,13081,United Kingdom,1,1671736
537034,22570,FELTCRAFT CUSHION RABBIT,8,12-03-2010 17:20,3.75,13081,United Kingdom,5,1274946
537034,22200,FRYING PAN PINK POLKADOT,4,12-03-2010 17:20,4.25,13081,United Kingdom,1,1689022
537034,22568,FELTCRAFT CUSHION OWL,8,12-03-2010 17:20,3.75,13081,United Kingdom,3,1055344
537034,21843,RED RETROSPOT CAKE STAND,2,12-03-2010 17:20,10.95,13081,United Kingdom,3,1493819
537035,37446,MINI CAKE STAND WITH HANGING CAKES,8,12-03-2010 17:21,1.45,13081,United Kingdom,3,1064554
537036,22660,DOORMAT I LOVE LONDON,1,12-03-2010 17:28,7.95,15545,United Kingdom,1,1284144
537036,22441,GROW YOUR OWN BASIL IN ENAMEL MUG,1,12-03-2010 17:28,2.1,15545,United Kingdom,5,1281040
537036,79067,CORONA MEXICAN TRAY,1,12-03-2010 17:28,3.75,15545,United Kingdom,3,1618914
537036,21360,JOY LARGE WOOD LETTERS,1,12-03-2010 17:28,9.95,15545,United Kingdom,3,1935453
537036,22076,6 RIBBONS EMPIRE,1,12-03-2010 17:28,1.65,15545,United Kingdom,1,1389162
537036,85049G,CHOCOLATE BOX RIBBONS,1,12-03-2010 17:28,1.25,15545,United Kingdom,2,1918346
537036,85049A,TRADITIONAL CHRISTMAS RIBBONS,1,12-03-2010 17:28,1.25,15545,United Kingdom,5,1686715
537036,85049E,SCANDINAVIAN REDS RIBBONS,1,12-03-2010 17:28,1.25,15545,United Kingdom,5,1125327
537036,22077,6 RIBBONS RUSTIC CHARM,1,12-03-2010 17:28,1.65,15545,United Kingdom,5,1853756
537036,22467,GUMBALL COAT RACK,1,12-03-2010 17:28,2.55,15545,United Kingdom,5,1584002
537036,22088,PAPER BUNTING COLOURED LACE,1,12-03-2010 17:28,2.95,15545,United Kingdom,1,1518111
537036,22037,ROBOT BIRTHDAY CARD,12,12-03-2010 17:28,0.42,15545,United Kingdom,3,1769823
537036,22024,RAINY LADIES BIRTHDAY CARD,12,12-03-2010 17:28,0.42,15545,United Kingdom,2,1020428
537036,20697,LITTLE GREEN MONSTER SOFT TOY,1,12-03-2010 17:28,2.55,15545,United Kingdom,3,1000869
537036,20699,MOUSEY LONG LEGS SOFT TOY,1,12-03-2010 17:28,2.55,15545,United Kingdom,2,1645771
537036,22671,FRENCH LAUNDRY SIGN BLUE METAL,1,12-03-2010 17:28,1.65,15545,United Kingdom,4,1850234
537036,84792,ENCHANTED BIRD COATHANGER 5 HOOK,1,12-03-2010 17:28,4.65,15545,United Kingdom,1,1762001
537036,22551,PLASTERS IN TIN SPACEBOY,1,12-03-2010 17:28,1.65,15545,United Kingdom,5,1852741
537036,22556,PLASTERS IN TIN CIRCUS PARADE,1,12-03-2010 17:28,1.65,15545,United Kingdom,5,1821961
537036,22555,PLASTERS IN TIN STRONGMAN,1,12-03-2010 17:28,1.65,15545,United Kingdom,5,1461880
537036,22117,METAL SIGN HER DINNER IS SERVED,1,12-03-2010 17:28,2.95,15545,United Kingdom,5,1140571
537036,82581,TOILET METAL SIGN,1,12-03-2010 17:28,0.55,15545,United Kingdom,1,1862982
537036,82580,BATHROOM METAL SIGN,1,12-03-2010 17:28,0.55,15545,United Kingdom,1,1049153
537036,82551,LAUNDRY 15C METAL SIGN,1,12-03-2010 17:28,1.45,15545,United Kingdom,3,1327878
537036,22625,RED KITCHEN SCALES,1,12-03-2010 17:28,8.5,15545,United Kingdom,5,1048462
537036,22616,PACK OF 12 LONDON TISSUES,12,12-03-2010 17:28,0.29,15545,United Kingdom,1,1840580
537036,84879,ASSORTED COLOUR BIRD ORNAMENT,8,12-03-2010 17:28,1.69,15545,United Kingdom,3,1722942
537036,22943,CHRISTMAS LIGHTS 10 VINTAGE BAUBLES,1,12-03-2010 17:28,4.95,15545,United Kingdom,1,1597286
537036,22837,HOT WATER BOTTLE BABUSHKA,5,12-03-2010 17:28,4.65,15545,United Kingdom,1,1688710
537036,35004C,SET OF 3 COLOURED  FLYING DUCKS,1,12-03-2010 17:28,5.45,15545,United Kingdom,1,1129524
537036,85135C,RED DRAGONFLY HELICOPTER,1,12-03-2010 17:28,7.95,15545,United Kingdom,3,1676952
537037,22114,HOT WATER BOTTLE TEA AND SYMPATHY,8,12-05-2010 10:03,3.95,17243,United Kingdom,2,1487083
537037,21485,RETROSPOT HEART HOT WATER BOTTLE,6,12-05-2010 10:03,4.95,17243,United Kingdom,4,1905999
537037,22835,HOT WATER BOTTLE I AM SO POORLY,3,12-05-2010 10:03,4.65,17243,United Kingdom,3,1496110
537037,84029E,RED WOOLLY HOTTIE WHITE HEART.,6,12-05-2010 10:03,3.75,17243,United Kingdom,1,1275922
537037,84029G,KNITTED UNION FLAG HOT WATER BOTTLE,6,12-05-2010 10:03,3.75,17243,United Kingdom,1,1254244
537037,22158,3 HEARTS HANGING DECORATION RUSTIC,8,12-05-2010 10:03,2.95,17243,United Kingdom,3,1188519
537037,22633,HAND WARMER UNION JACK,24,12-05-2010 10:03,2.1,17243,United Kingdom,5,1993610
537037,22988,SOLDIERS EGG CUP,12,12-05-2010 10:03,1.25,17243,United Kingdom,5,1215763
537037,82494L,WOODEN FRAME ANTIQUE WHITE,6,12-05-2010 10:03,2.95,17243,United Kingdom,3,1317133
537037,72800E,4 IVORY DINNER CANDLES SILVER FLOCK,11,12-05-2010 10:03,2.55,17243,United Kingdom,3,1627005
537037,21034,REX CASH+CARRY JUMBO SHOPPER,2,12-05-2010 10:03,0.95,17243,United Kingdom,3,1754923
537038,21523,DOORMAT FANCY FONT HOME SWEET HOME,10,12-05-2010 10:12,6.75,15465,United Kingdom,5,1358419
537038,21524,DOORMAT SPOTTY HOME SWEET HOME,3,12-05-2010 10:12,7.95,15465,United Kingdom,2,1084731
537038,22086,PAPER CHAIN KIT 50'S CHRISTMAS,80,12-05-2010 10:12,2.55,15465,United Kingdom,5,1239331
537038,21754,HOME BUILDING BLOCK WORD,3,12-05-2010 10:12,5.95,15465,United Kingdom,4,1981159
537038,21755,LOVE BUILDING BLOCK WORD,3,12-05-2010 10:12,5.95,15465,United Kingdom,4,1754498
537038,22083,PAPER CHAIN KIT RETROSPOT,10,12-05-2010 10:12,2.95,15465,United Kingdom,1,1197700
537038,22423,REGENCY CAKESTAND 3 TIER,16,12-05-2010 10:12,10.95,15465,United Kingdom,3,1847345
C537039,22854,CREAM SWEETHEART EGG HOLDER,-1,12-05-2010 10:25,4.95,15708,United Kingdom,2,1617777
C537039,20936,FORKED CACTUS CANDLE,-1,12-05-2010 10:25,2.95,15708,United Kingdom,3,1988093
C537039,85175,CACTI T-LIGHT CANDLES,-1,12-05-2010 10:25,0.42,15708,United Kingdom,2,1437055
537040,22423,REGENCY CAKESTAND 3 TIER,48,12-05-2010 10:27,10.95,13089,United Kingdom,2,1127156
537040,84949,SILVER HANGING T-LIGHT HOLDER,144,12-05-2010 10:27,1.45,13089,United Kingdom,4,1339766
537041,22726,ALARM CLOCK BAKELIKE GREEN,4,12-05-2010 10:36,3.75,16033,United Kingdom,2,1115947
537041,22730,ALARM CLOCK BAKELIKE IVORY,4,12-05-2010 10:36,3.75,16033,United Kingdom,3,1514221
537041,22727,ALARM CLOCK BAKELIKE RED,4,12-05-2010 10:36,3.75,16033,United Kingdom,4,1544985
537041,22728,ALARM CLOCK BAKELIKE PINK,3,12-05-2010 10:36,3.75,16033,United Kingdom,4,1503486
537041,22358,KINGS CHOICE TEA CADDY,1,12-05-2010 10:36,2.95,16033,United Kingdom,3,1767006
537041,21876,POTTERING MUG,1,12-05-2010 10:36,1.25,16033,United Kingdom,4,1320507
537041,21868,POTTING SHED TEA MUG,1,12-05-2010 10:36,1.25,16033,United Kingdom,3,1637676
537041,21877,HOME SWEET HOME MUG,2,12-05-2010 10:36,1.25,16033,United Kingdom,1,1665182
537041,37370,RETRO COFFEE MUGS ASSORTED,2,12-05-2010 10:36,1.25,16033,United Kingdom,1,1418630
537041,22652,TRAVEL SEWING KIT,4,12-05-2010 10:36,1.65,16033,United Kingdom,2,1984531
537041,22507,MEMO BOARD RETROSPOT  DESIGN,2,12-05-2010 10:36,4.95,16033,United Kingdom,3,1500353
537041,85054,FRENCH ENAMEL POT W LID,2,12-05-2010 10:36,2.95,16033,United Kingdom,2,1114805
537041,85055,FRENCH ENAMEL UTENSIL HOLDER,2,12-05-2010 10:36,3.75,16033,United Kingdom,4,1472195
537041,21165,BEWARE OF THE CAT METAL SIGN,6,12-05-2010 10:36,1.69,16033,United Kingdom,2,1262908
537041,22666,RECIPE BOX PANTRY YELLOW DESIGN,2,12-05-2010 10:36,2.95,16033,United Kingdom,4,1403237
537041,22667,RECIPE BOX RETROSPOT,2,12-05-2010 10:36,2.95,16033,United Kingdom,2,1628674
537041,84924A,WAKE UP COCKEREL CALENDAR SIGN,1,12-05-2010 10:36,3.75,16033,United Kingdom,2,1513457
537041,22630,DOLLY GIRL LUNCH BOX,1,12-05-2010 10:36,1.95,16033,United Kingdom,5,1372507
537041,22629,SPACEBOY LUNCH BOX,1,12-05-2010 10:36,1.95,16033,United Kingdom,2,1175468
537041,22955,36 FOIL STAR CAKE CASES,1,12-05-2010 10:36,2.1,16033,United Kingdom,1,1305603
537041,22956,36 FOIL HEART CAKE CASES,1,12-05-2010 10:36,2.1,16033,United Kingdom,2,1062066
537041,22426,ENAMEL WASH BOWL CREAM,1,12-05-2010 10:36,3.75,16033,United Kingdom,1,1361816
537041,22427,ENAMEL FLOWER JUG CREAM,1,12-05-2010 10:36,5.95,16033,United Kingdom,2,1365867
537041,22193,RED DINER WALL CLOCK,1,12-05-2010 10:36,8.5,16033,United Kingdom,1,1918575
537041,35810B,ENAMEL BLUE RIM COFFEE CONTAINER,1,12-05-2010 10:36,2.1,16033,United Kingdom,3,1189746
537041,35241,ENAMEL BLUE RIM BISCUIT BIN,1,12-05-2010 10:36,4.95,16033,United Kingdom,1,1514533
537042,22969,HOMEMADE JAM SCENTED CANDLES,12,12-05-2010 10:45,1.45,13838,United Kingdom,3,1218853
537042,21756,BATH BUILDING BLOCK WORD,2,12-05-2010 10:45,5.95,13838,United Kingdom,4,1687590
537042,21260,FIRST AID TIN,1,12-05-2010 10:45,3.25,13838,United Kingdom,1,1618158
537042,84580,MOUSE TOY WITH PINK T-SHIRT,1,12-05-2010 10:45,3.75,13838,United Kingdom,2,1080170
537042,85014A,BLACK/BLUE POLKADOT UMBRELLA,1,12-05-2010 10:45,5.95,13838,United Kingdom,4,1188349
537042,85014B,RED RETROSPOT UMBRELLA,1,12-05-2010 10:45,5.95,13838,United Kingdom,4,1759272
537042,15056P,EDWARDIAN PARASOL PINK,2,12-05-2010 10:45,5.95,13838,United Kingdom,4,1295116
537042,15056N,EDWARDIAN PARASOL NATURAL,1,12-05-2010 10:45,5.95,13838,United Kingdom,4,1834536
537042,20679,EDWARDIAN PARASOL RED,1,12-05-2010 10:45,5.95,13838,United Kingdom,4,1053281
537042,15056BL,EDWARDIAN PARASOL BLACK,1,12-05-2010 10:45,5.95,13838,United Kingdom,1,1964898
537042,21524,DOORMAT SPOTTY HOME SWEET HOME,1,12-05-2010 10:45,7.95,13838,United Kingdom,4,1991799
537042,22955,36 FOIL STAR CAKE CASES,1,12-05-2010 10:45,2.1,13838,United Kingdom,3,1587177
537042,22956,36 FOIL HEART CAKE CASES,1,12-05-2010 10:45,2.1,13838,United Kingdom,2,1695392
537042,22666,RECIPE BOX PANTRY YELLOW DESIGN,1,12-05-2010 10:45,2.95,13838,United Kingdom,4,1620937
537042,21533,RETROSPOT LARGE MILK JUG,1,12-05-2010 10:45,4.95,13838,United Kingdom,1,1163786
537042,22730,ALARM CLOCK BAKELIKE IVORY,1,12-05-2010 10:45,3.75,13838,United Kingdom,2,1773395
537042,21259,VICTORIAN SEWING BOX SMALL,1,12-05-2010 10:45,5.95,13838,United Kingdom,3,1253371
537042,21850,BLUE  DIAMANTE PEN IN GIFT BOX,1,12-05-2010 10:45,4.95,13838,United Kingdom,4,1234782
537042,20773,BLUE PAISLEY NOTEBOOK,1,12-05-2010 10:45,1.65,13838,United Kingdom,4,1175185
537042,21579,LOLITA  DESIGN  COTTON TOTE BAG,1,12-05-2010 10:45,2.25,13838,United Kingdom,2,1695189
537042,21985,PACK OF 12 HEARTS DESIGN TISSUES,12,12-05-2010 10:45,0.29,13838,United Kingdom,3,1676913
537042,22697,GREEN REGENCY TEACUP AND SAUCER,1,12-05-2010 10:45,2.95,13838,United Kingdom,3,1983275
537042,22699,ROSES REGENCY TEACUP AND SAUCER,1,12-05-2010 10:45,2.95,13838,United Kingdom,5,1997828
537042,22508,DOORSTOP RETROSPOT HEART,1,12-05-2010 10:45,3.75,13838,United Kingdom,4,1808503
537042,21930,JUMBO STORAGE BAG SKULLS,1,12-05-2010 10:45,1.95,13838,United Kingdom,3,1670080
537042,21579,LOLITA  DESIGN  COTTON TOTE BAG,1,12-05-2010 10:45,2.25,13838,United Kingdom,3,1742729
537042,21755,LOVE BUILDING BLOCK WORD,1,12-05-2010 10:45,5.95,13838,United Kingdom,5,1666433
537042,21579,LOLITA  DESIGN  COTTON TOTE BAG,1,12-05-2010 10:45,2.25,13838,United Kingdom,3,1693391
537042,22862,LOVE HEART NAPKIN BOX,1,12-05-2010 10:45,4.25,13838,United Kingdom,1,1635488
537042,22327,ROUND SNACK BOXES SET OF 4 SKULLS,1,12-05-2010 10:45,2.95,13838,United Kingdom,2,1266561
537042,22423,REGENCY CAKESTAND 3 TIER,1,12-05-2010 10:45,12.75,13838,United Kingdom,1,1095877
537042,21192,WHITE BELL HONEYCOMB PAPER,2,12-05-2010 10:45,1.65,13838,United Kingdom,5,1989257
537042,22469,HEART OF WICKER SMALL,1,12-05-2010 10:45,1.65,13838,United Kingdom,3,1509097
537042,22470,HEART OF WICKER LARGE,1,12-05-2010 10:45,2.95,13838,United Kingdom,2,1830253
537042,22316,200 BENDY SKULL STRAWS,1,12-05-2010 10:45,1.25,13838,United Kingdom,1,1348094
537042,21112,"SWISS ROLL TOWEL, PINK  SPOTS",1,12-05-2010 10:45,2.95,13838,United Kingdom,4,1629038
537042,17109D,FLOWER FAIRY INCENSE BOUQUET,2,12-05-2010 10:45,1.69,13838,United Kingdom,5,1309968
537042,47591D,PINK FAIRY CAKE CHILDRENS APRON,1,12-05-2010 10:45,1.95,13838,United Kingdom,2,1293268
537042,21328,BALLOONS  WRITING SET,1,12-05-2010 10:45,1.65,13838,United Kingdom,2,1073866
537042,22904,CALENDAR PAPER CUT DESIGN,1,12-05-2010 10:45,2.95,13838,United Kingdom,5,1164254
537042,21427,SKULLS STORAGE BOX SMALL,1,12-05-2010 10:45,2.1,13838,United Kingdom,5,1820208
537042,21011,GLITTER SNOW PEAR TREE DECORATION,2,12-05-2010 10:45,1.45,13838,United Kingdom,4,1063663
537042,22372,AIRLINE BAG VINTAGE WORLD CHAMPION,1,12-05-2010 10:45,4.25,13838,United Kingdom,1,1648717
537042,22624,IVORY KITCHEN SCALES,1,12-05-2010 10:45,8.5,13838,United Kingdom,2,1837061
537042,22961,JAM MAKING SET PRINTED,3,12-05-2010 10:45,1.45,13838,United Kingdom,5,1057326
537042,22853,CAT BOWL VINTAGE CREAM,1,12-05-2010 10:45,3.25,13838,United Kingdom,1,1893542
537042,22311,OFFICE MUG WARMER BLACK+SILVER,1,12-05-2010 10:45,2.95,13838,United Kingdom,2,1472271
537042,21192,WHITE BELL HONEYCOMB PAPER,3,12-05-2010 10:45,1.65,13838,United Kingdom,3,1325990
537042,22118,JOY WOODEN BLOCK LETTERS,1,12-05-2010 10:45,4.95,13838,United Kingdom,2,1104625
537042,22968,ROSE COTTAGE KEEPSAKE BOX,1,12-05-2010 10:45,9.95,13838,United Kingdom,2,1782082
537042,22665,RECIPE BOX BLUE SKETCHBOOK DESIGN,1,12-05-2010 10:45,2.95,13838,United Kingdom,4,1006940
537042,22666,RECIPE BOX PANTRY YELLOW DESIGN,1,12-05-2010 10:45,2.95,13838,United Kingdom,1,1768795
C537043,22575,METAL MERRY CHRISTMAS WREATH,-6,12-05-2010 10:48,1.95,15351,United Kingdom,5,1424742
C537043,11001,ASSTD DESIGN RACING CAR PEN,-1,12-05-2010 10:48,1.69,15351,United Kingdom,1,1517827
537044,72807B,SET/3 OCEAN SCENT CANDLE JEWEL BOX,4,12-05-2010 10:52,4.25,18055,United Kingdom,1,1394447
537044,85034B,3 WHITE CHOC MORRIS BOXED CANDLES,4,12-05-2010 10:52,4.25,18055,United Kingdom,5,1748823
537044,72802C,VANILLA SCENT CANDLE JEWELLED BOX,6,12-05-2010 10:52,4.25,18055,United Kingdom,4,1997337
537044,72802B,OCEAN SCENT CANDLE IN JEWELLED BOX,6,12-05-2010 10:52,4.25,18055,United Kingdom,5,1552986
537044,72800B,4 PURPLE FLOCK DINNER CANDLES,12,12-05-2010 10:52,2.55,18055,United Kingdom,2,1907682
537044,21479,WHITE SKULL HOT WATER BOTTLE,4,12-05-2010 10:52,3.75,18055,United Kingdom,4,1420628
537044,72800D,4 BLUE DINNER CANDLES SILVER FLOCK,12,12-05-2010 10:52,2.55,18055,United Kingdom,4,1493965
537044,22802,FAUX FUR CHOCOLATE THROW,2,12-05-2010 10:52,19.95,18055,United Kingdom,1,1969914
537044,22947,WOODEN ADVENT CALENDAR RED,2,12-05-2010 10:52,16.95,18055,United Kingdom,2,1070547
537044,22114,HOT WATER BOTTLE TEA AND SYMPATHY,4,12-05-2010 10:52,3.95,18055,United Kingdom,2,1845995
537044,84030E,ENGLISH ROSE HOT WATER BOTTLE,4,12-05-2010 10:52,4.25,18055,United Kingdom,5,1231492
537044,22476,EMPIRE UNION JACK TV DINNER TRAY,3,12-05-2010 10:52,4.95,18055,United Kingdom,1,1273577
537044,22473,TV DINNER TRAY VINTAGE PAISLEY,3,12-05-2010 10:52,4.95,18055,United Kingdom,4,1009929
537044,22471,TV DINNER TRAY AIR HOSTESS,3,12-05-2010 10:52,4.95,18055,United Kingdom,2,1913346
537044,85123A,WHITE HANGING HEART T-LIGHT HOLDER,6,12-05-2010 10:52,2.95,18055,United Kingdom,2,1829993
537044,22835,HOT WATER BOTTLE I AM SO POORLY,4,12-05-2010 10:52,4.65,18055,United Kingdom,4,1623677
537044,22112,CHOCOLATE HOT WATER BOTTLE,9,12-05-2010 10:52,4.95,18055,United Kingdom,1,1491579
537044,21258,VICTORIAN SEWING BOX LARGE,2,12-05-2010 10:52,12.75,18055,United Kingdom,4,1921492
537044,84819,DANISH ROSE ROUND SEWING BOX,3,12-05-2010 10:52,4.25,18055,United Kingdom,4,1341877
537045,90175C,BLUE GLASS CHUNKY CHARM BRACELET,1,12-05-2010 10:54,8.95,15038,United Kingdom,1,1906231
537045,90185D,CRYSTAL DIAMANTE EXPANDABLE RING,1,12-05-2010 10:54,4.25,15038,United Kingdom,1,1135689
537045,90210B,CLEAR ACRYLIC FACETED BANGLE,1,12-05-2010 10:54,2.95,15038,United Kingdom,5,1022945
537045,90175A,WHITE GLASS CHUNKY CHARM BRACELET,1,12-05-2010 10:54,8.95,15038,United Kingdom,1,1116084
537045,90002D,FLOWER BURST SILVER RING CRYSTAL,1,12-05-2010 10:54,3.75,15038,United Kingdom,2,1736821
537045,22295,HEART FILIGREE DOVE LARGE,1,12-05-2010 10:54,1.65,15038,United Kingdom,2,1508113
537045,22297,HEART IVORY TRELLIS SMALL,2,12-05-2010 10:54,1.25,15038,United Kingdom,3,1242522
537045,22296,HEART IVORY TRELLIS LARGE,1,12-05-2010 10:54,1.65,15038,United Kingdom,4,1814476
537045,72802A,ROSE SCENT CANDLE IN JEWELLED BOX,1,12-05-2010 10:54,4.25,15038,United Kingdom,3,1086330
537045,72802C,VANILLA SCENT CANDLE JEWELLED BOX,1,12-05-2010 10:54,4.25,15038,United Kingdom,5,1139601
537045,22158,3 HEARTS HANGING DECORATION RUSTIC,1,12-05-2010 10:54,2.95,15038,United Kingdom,4,1713723
537045,72802B,OCEAN SCENT CANDLE IN JEWELLED BOX,1,12-05-2010 10:54,4.25,15038,United Kingdom,4,1807145
537045,72802A,ROSE SCENT CANDLE IN JEWELLED BOX,1,12-05-2010 10:54,4.25,15038,United Kingdom,2,1724872
537045,72802C,VANILLA SCENT CANDLE JEWELLED BOX,2,12-05-2010 10:54,4.25,15038,United Kingdom,3,1038193
537045,72807C,SET/3 VANILLA SCENTED CANDLE IN BOX,2,12-05-2010 10:54,4.25,15038,United Kingdom,4,1108389
537045,22112,CHOCOLATE HOT WATER BOTTLE,1,12-05-2010 10:54,4.95,15038,United Kingdom,1,1639185
537045,21485,RETROSPOT HEART HOT WATER BOTTLE,1,12-05-2010 10:54,4.95,15038,United Kingdom,1,1090754
537045,22458,CAST IRON HOOK GARDEN FORK,1,12-05-2010 10:54,2.55,15038,United Kingdom,4,1928763
537045,22459,CAST IRON HOOK GARDEN TROWEL,1,12-05-2010 10:54,2.55,15038,United Kingdom,4,1974383
537045,21907,I'M ON HOLIDAY METAL SIGN,1,12-05-2010 10:54,2.1,15038,United Kingdom,4,1383515
537045,85152,HAND OVER THE CHOCOLATE   SIGN,3,12-05-2010 10:54,2.1,15038,United Kingdom,5,1508723
537045,21165,BEWARE OF THE CAT METAL SIGN,1,12-05-2010 10:54,1.69,15038,United Kingdom,5,1278968
537045,21174,POTTERING IN THE SHED METAL SIGN,1,12-05-2010 10:54,1.95,15038,United Kingdom,3,1841547
537045,21166,COOK WITH WINE METAL SIGN,2,12-05-2010 10:54,1.95,15038,United Kingdom,4,1472689
537045,21181,PLEASE ONE PERSON METAL SIGN,2,12-05-2010 10:54,2.1,15038,United Kingdom,1,1905303
537045,85150,LADIES & GENTLEMEN METAL SIGN,1,12-05-2010 10:54,2.55,15038,United Kingdom,4,1152298
537045,21175,GIN + TONIC DIET METAL SIGN,1,12-05-2010 10:54,2.1,15038,United Kingdom,4,1507978
537045,21169,YOU'RE CONFUSING ME METAL SIGN,1,12-05-2010 10:54,1.69,15038,United Kingdom,5,1037194
537045,22156,HEART DECORATION WITH PEARLS,4,12-05-2010 10:54,0.85,15038,United Kingdom,2,1299016
537045,22296,HEART IVORY TRELLIS LARGE,1,12-05-2010 10:54,1.65,15038,United Kingdom,3,1066565
537045,22295,HEART FILIGREE DOVE LARGE,1,12-05-2010 10:54,1.65,15038,United Kingdom,1,1876618
537045,22294,HEART FILIGREE DOVE  SMALL,1,12-05-2010 10:54,1.25,15038,United Kingdom,1,1868539
537045,22297,HEART IVORY TRELLIS SMALL,1,12-05-2010 10:54,1.25,15038,United Kingdom,1,1379337
537045,22469,HEART OF WICKER SMALL,1,12-05-2010 10:54,1.65,15038,United Kingdom,4,1330190
537045,21876,POTTERING MUG,2,12-05-2010 10:54,1.25,15038,United Kingdom,2,1076456
537046,22169,FAMILY ALBUM WHITE PICTURE FRAME,16,12-05-2010 10:58,7.65,18109,United Kingdom,2,1872532
537046,22469,HEART OF WICKER SMALL,6,12-05-2010 10:58,1.65,18109,United Kingdom,4,1430621
537046,22470,HEART OF WICKER LARGE,3,12-05-2010 10:58,2.95,18109,United Kingdom,3,1778770
537046,82484,WOOD BLACK BOARD ANT WHITE FINISH,2,12-05-2010 10:58,6.45,18109,United Kingdom,2,1373151
537046,21333,CLASSIC WHITE FRAME,1,12-05-2010 10:58,2.95,18109,United Kingdom,4,1281454
537046,22855,FINE WICKER HEART,7,12-05-2010 10:58,1.25,18109,United Kingdom,3,1705934
537046,82486,WOOD S/3 CABINET ANT WHITE FINISH,1,12-05-2010 10:58,7.95,18109,United Kingdom,5,1440918
537046,85123A,WHITE HANGING HEART T-LIGHT HOLDER,1,12-05-2010 10:58,2.95,18109,United Kingdom,1,1550578
537046,21363,HOME SMALL WOOD LETTERS,1,12-05-2010 10:58,4.95,18109,United Kingdom,3,1953405
537046,82482,WOODEN PICTURE FRAME WHITE FINISH,1,12-05-2010 10:58,2.55,18109,United Kingdom,3,1110514
537046,85064,CREAM SWEETHEART LETTER RACK,1,12-05-2010 10:58,5.45,18109,United Kingdom,2,1425004
537046,85066,CREAM SWEETHEART MINI CHEST,2,12-05-2010 10:58,12.75,18109,United Kingdom,5,1027909
537046,22667,RECIPE BOX RETROSPOT,5,12-05-2010 10:58,2.95,18109,United Kingdom,1,1802902
537046,21259,VICTORIAN SEWING BOX SMALL,8,12-05-2010 10:58,5.95,18109,United Kingdom,2,1715807
537047,22603,CHRISTMAS RETROSPOT TREE WOOD,5,12-05-2010 11:02,0.85,13069,United Kingdom,3,1237422
537047,22577,WOODEN HEART CHRISTMAS SCANDINAVIAN,5,12-05-2010 11:02,0.85,13069,United Kingdom,5,1966006
537047,22581,WOOD STOCKING CHRISTMAS SCANDISPOT,5,12-05-2010 11:02,0.85,13069,United Kingdom,5,1778938
537047,22579,WOODEN TREE CHRISTMAS SCANDINAVIAN,5,12-05-2010 11:02,0.85,13069,United Kingdom,2,1192326
537047,22578,WOODEN STAR CHRISTMAS SCANDINAVIAN,5,12-05-2010 11:02,0.85,13069,United Kingdom,5,1818163
537047,22600,CHRISTMAS RETROSPOT STAR WOOD,5,12-05-2010 11:02,0.85,13069,United Kingdom,2,1012454
537047,22602,CHRISTMAS RETROSPOT HEART WOOD,5,12-05-2010 11:02,0.85,13069,United Kingdom,3,1834951
537047,22601,CHRISTMAS RETROSPOT ANGEL WOOD,5,12-05-2010 11:02,0.85,13069,United Kingdom,5,1723297
537047,10002,INFLATABLE POLITICAL GLOBE,1,12-05-2010 11:02,0.85,13069,United Kingdom,4,1810943
537047,20751,FUNKY WASHING UP GLOVES ASSORTED,2,12-05-2010 11:02,2.1,13069,United Kingdom,1,1136339
537047,22739,RIBBON REEL CHRISTMAS SOCK BAUBLE,2,12-05-2010 11:02,1.65,13069,United Kingdom,1,1019774
537047,22737,RIBBON REEL CHRISTMAS PRESENT,3,12-05-2010 11:02,1.65,13069,United Kingdom,3,1340845
537047,22735,RIBBON REEL SOCKS AND MITTENS,2,12-05-2010 11:02,1.65,13069,United Kingdom,4,1972829
537047,22738,RIBBON REEL SNOWY VILLAGE,2,12-05-2010 11:02,1.65,13069,United Kingdom,3,1211821
537047,22736,RIBBON REEL MAKING SNOWMEN,2,12-05-2010 11:02,1.65,13069,United Kingdom,5,1159465
537047,22130,PARTY CONE CHRISTMAS DECORATION,6,12-05-2010 11:02,0.85,13069,United Kingdom,4,1912709
537047,22630,DOLLY GIRL LUNCH BOX,1,12-05-2010 11:02,1.95,13069,United Kingdom,5,1172239
537047,22086,PAPER CHAIN KIT 50'S CHRISTMAS,1,12-05-2010 11:02,2.95,13069,United Kingdom,3,1623879
537047,22867,HAND WARMER BIRD DESIGN,5,12-05-2010 11:02,2.1,13069,United Kingdom,5,1596932
537047,22632,HAND WARMER RED RETROSPOT,2,12-05-2010 11:02,2.1,13069,United Kingdom,5,1199753
537047,22834,HAND WARMER BABUSHKA DESIGN,2,12-05-2010 11:02,2.1,13069,United Kingdom,3,1124395
537047,22866,HAND WARMER SCOTTY DOG DESIGN,5,12-05-2010 11:02,2.1,13069,United Kingdom,2,1190066
537047,22865,HAND WARMER OWL DESIGN,5,12-05-2010 11:02,2.1,13069,United Kingdom,5,1109649
537047,21754,HOME BUILDING BLOCK WORD,18,12-05-2010 11:02,5.45,13069,United Kingdom,1,1503270
537047,22809,SET OF 6 T-LIGHTS SANTA,2,12-05-2010 11:02,2.95,13069,United Kingdom,5,1869753
537047,22593,CHRISTMAS GINGHAM STAR,10,12-05-2010 11:02,0.85,13069,United Kingdom,5,1118891
537047,22595,CHRISTMAS GINGHAM HEART,10,12-05-2010 11:02,0.85,13069,United Kingdom,5,1435296
537047,22594,CHRISTMAS GINGHAM TREE,10,12-05-2010 11:02,0.85,13069,United Kingdom,2,1425878
537047,22694,WICKER STAR,2,12-05-2010 11:02,2.1,13069,United Kingdom,5,1013632
