InvoiceNo,StockCode,Description,Quantity,InvoiceDate,UnitPrice,customer_id,Country,review_score,product_id
536591,72807C,SET/3 VANILLA SCENTED CANDLE IN BOX,2,12-01-2010 16:57,4.25,14606,United Kingdom,1,1979755
536591,22497,SET OF 2 TINS VINTAGE BATHROOM,1,12-01-2010 16:57,4.25,14606,United Kingdom,1,1595795
536591,21850,BLUE  DIAMANTE PEN IN GIFT BOX,1,12-01-2010 16:57,4.95,14606,United Kingdom,4,1723397
536591,20978,36 PENCILS TUBE SKULLS,2,12-01-2010 16:57,1.25,14606,United Kingdom,1,1197349
536591,20768,GREEN FERN JOURNAL,1,12-01-2010 16:57,2.55,14606,United Kingdom,3,1152744
536591,22081,RIBBON REEL FLORA + FAUNA,1,12-01-2010 16:57,1.65,14606,United Kingdom,2,1493618
536591,20780,BLACK EAR MUFF HEADPHONES,1,12-01-2010 16:57,5.49,14606,United Kingdom,2,1647736
536591,51014C,"FEATHER PEN,COAL BLACK",12,12-01-2010 16:57,0.85,14606,United Kingdom,1,1207428
536591,21398,RED POLKADOT COFFEE  MUG,1,12-01-2010 16:57,2.1,14606,United Kingdom,3,1409157
536591,22476,EMPIRE UNION JACK TV DINNER TRAY,2,12-01-2010 16:57,4.95,14606,United Kingdom,2,1257314
536591,21643,ASSORTED TUTTI FRUTTI MIRROR,3,12-01-2010 16:57,1.25,14606,United Kingdom,5,1350864
536591,72741,GRAND CHOCOLATECANDLE,27,12-01-2010 16:57,1.45,14606,United Kingdom,1,1190528
536591,21620,SET OF 4 ROSE BOTANICAL CANDLES,1,12-01-2010 16:57,3.75,14606,United Kingdom,5,1145811
536591,37449,CERAMIC CAKE STAND + HANGING CAKES,1,12-01-2010 16:57,9.95,14606,United Kingdom,2,1186303
536591,22260,FELT EGG COSY BLUE RABBIT,5,12-01-2010 16:57,0.85,14606,United Kingdom,3,1440838
536591,22136,LOVE HEART SOCK HANGER,1,12-01-2010 16:57,1.65,14606,United Kingdom,2,1049993
536591,47591B,SCOTTIES CHILDRENS APRON,1,12-01-2010 16:57,1.65,14606,United Kingdom,5,1736279
536591,21041,RED RETROSPOT OVEN GLOVE DOUBLE,1,12-01-2010 16:57,2.95,14606,United Kingdom,5,1664034
536591,21035,SET/2 RED RETROSPOT TEA TOWELS,1,12-01-2010 16:57,2.95,14606,United Kingdom,5,1170013
536591,85064,CREAM SWEETHEART LETTER RACK,2,12-01-2010 16:58,5.45,14606,United Kingdom,2,1002009
536591,22121,NOEL WOODEN BLOCK LETTERS,2,12-01-2010 16:58,5.95,14606,United Kingdom,3,1948757
536591,21488,RED WHITE SCARF  HOT WATER BOTTLE,1,12-01-2010 16:58,3.95,14606,United Kingdom,1,1739874
536591,21484,CHICK GREY HOT WATER BOTTLE,2,12-01-2010 16:58,3.45,14606,United Kingdom,1,1632306
536591,22357,KINGS CHOICE BISCUIT TIN,1,12-01-2010 16:58,4.25,14606,United Kingdom,3,1234007
536591,21985,PACK OF 12 HEARTS DESIGN TISSUES,4,12-01-2010 16:58,0.29,14606,United Kingdom,3,1052528
536592,10135,COLOURING PENCILS BROWN TUBE,1,12-01-2010 17:06,2.51,,United Kingdom,4,1778085
536592,16168M,FUNKY MONKEY GIFT BAG MEDIUM,2,12-01-2010 17:06,0.85,,United Kingdom,5,1694415
536592,16236,KITTY PENCIL ERASERS,1,12-01-2010 17:06,0.43,,United Kingdom,4,1526219
536592,16237,SLEEPING CAT ERASERS,6,12-01-2010 17:06,0.43,,United Kingdom,3,1691282
536592,16238,PARTY TIME PENCIL ERASERS,5,12-01-2010 17:06,0.43,,United Kingdom,5,1783620
536592,17012A,ORIGAMI VANILLA INCENSE/CANDLE SET,1,12-01-2010 17:06,2.51,,United Kingdom,5,1702630
536592,17012B,ORIGAMI JASMINE INCENSE/CANDLE SET,1,12-01-2010 17:06,2.51,,United Kingdom,2,1850928
536592,17012C,ORIGAMI LAVENDER INCENSE/CANDL SET,1,12-01-2010 17:06,2.51,,United Kingdom,1,1317379
536592,17012D,ORIGAMI ROSE INCENSE/CANDLE SET,1,12-01-2010 17:06,2.51,,United Kingdom,1,1675677
536592,17012E,ORIGAMI OPIUM INCENSE/CANDLE SET,1,12-01-2010 17:06,2.51,,United Kingdom,3,1925852
536592,17012F,ORIGAMI SANDLEWOOD INCENSE/CAND SET,1,12-01-2010 17:06,2.51,,United Kingdom,2,1953222
536592,17014A,ORIGAMI VANILLA INCENSE CONES,1,12-01-2010 17:06,3.36,,United Kingdom,3,1353254
536592,17084N,FAIRY DREAMS INCENSE,2,12-01-2010 17:06,0.43,,United Kingdom,3,1347273
536592,17084P,DRAGONS BLOOD INCENSE,1,12-01-2010 17:06,0.43,,United Kingdom,3,1770611
536592,20616,CHERRY BLOSSOM PASSPORT COVER,1,12-01-2010 17:06,4.21,,United Kingdom,4,1312593
536592,20617,FIRST CLASS PASSPORT COVER,1,12-01-2010 17:06,4.21,,United Kingdom,3,1274423
536592,20619,TROPICAL PASSPORT COVER,1,12-01-2010 17:06,4.21,,United Kingdom,1,1822778
536592,20653,CHERRY BLOSSOM LUGGAGE TAG,1,12-01-2010 17:06,2.51,,United Kingdom,1,1035330
536592,20668,DISCO BALL CHRISTMAS DECORATION,6,12-01-2010 17:06,0.43,,United Kingdom,2,1686444
536592,20681,PINK POLKADOT CHILDRENS UMBRELLA,1,12-01-2010 17:06,6.77,,United Kingdom,5,1493162
536592,20682,RED RETROSPOT CHILDRENS UMBRELLA,2,12-01-2010 17:06,6.77,,United Kingdom,5,1205193
536592,20696,FLORAL SOFT CAR TOY,1,12-01-2010 17:06,7.62,,United Kingdom,3,1858765
536592,20699,MOUSEY LONG LEGS SOFT TOY,2,12-01-2010 17:06,5.06,,United Kingdom,2,1644590
536592,20700,GREEN CAT FLORAL CUSHION COVER,1,12-01-2010 17:06,10.17,,United Kingdom,1,1262742
536592,20717,STRAWBERRY SHOPPER BAG,1,12-01-2010 17:06,2.51,,United Kingdom,3,1391131
536592,20718,RED RETROSPOT SHOPPER BAG,1,12-01-2010 17:06,2.51,,United Kingdom,2,1561506
536592,20723,STRAWBERRY CHARLOTTE BAG,1,12-01-2010 17:06,1.66,,United Kingdom,4,1118124
536592,20724,RED RETROSPOT CHARLOTTE BAG,1,12-01-2010 17:06,1.66,,United Kingdom,4,1819162
536592,20725,LUNCH BAG RED RETROSPOT,2,12-01-2010 17:06,4.21,,United Kingdom,5,1723793
536592,20727,LUNCH BAG  BLACK SKULL.,2,12-01-2010 17:06,4.21,,United Kingdom,3,1279631
536592,20733,GOLD MINI TAPE MEASURE,6,12-01-2010 17:06,0.85,,United Kingdom,2,1006472
536592,20735,BLACK MINI TAPE MEASURE,4,12-01-2010 17:06,0.85,,United Kingdom,2,1630644
536592,20752,BLUE POLKADOT WASHING UP GLOVES,1,12-01-2010 17:06,4.21,,United Kingdom,4,1852908
536592,20754,RETROSPOT RED WASHING UP GLOVES,1,12-01-2010 17:06,4.21,,United Kingdom,1,1146015
536592,20761,BLUE PAISLEY SKETCHBOOK,1,12-01-2010 17:06,7.62,,United Kingdom,2,1313268
536592,20780,BLACK EAR MUFF HEADPHONES,1,12-01-2010 17:06,11.02,,United Kingdom,2,1934755
536592,20846,ZINC HEART LATTICE T-LIGHT HOLDER,1,12-01-2010 17:06,2.51,,United Kingdom,2,1075475
536592,20914,SET/5 RED RETROSPOT LID GLASS BOWLS,1,12-01-2010 17:06,5.91,,United Kingdom,1,1787528
536592,20931,BLUE POT PLANT CANDLE,2,12-01-2010 17:06,7.62,,United Kingdom,2,1114653
536592,20956,PORCELAIN T-LIGHT HOLDERS ASSORTED,2,12-01-2010 17:06,2.51,,United Kingdom,4,1708779
536592,20961,STRAWBERRY BATH SPONGE,1,12-01-2010 17:06,2.51,,United Kingdom,3,1342257
536592,20966,SANDWICH BATH SPONGE,1,12-01-2010 17:06,2.51,,United Kingdom,5,1075278
536592,20972,PINK CREAM FELT CRAFT TRINKET BOX,1,12-01-2010 17:06,2.51,,United Kingdom,5,1902897
536592,20973,12 PENCIL SMALL TUBE WOODLAND,15,12-01-2010 17:06,1.28,,United Kingdom,3,1841108
536592,20974,12 PENCILS SMALL TUBE SKULL,12,12-01-2010 17:06,1.28,,United Kingdom,1,1932382
536592,20975,12 PENCILS SMALL TUBE RED RETROSPOT,18,12-01-2010 17:06,1.28,,United Kingdom,5,1390275
536592,21002,ROSE DU SUD DRAWSTRING BAG,2,12-01-2010 17:06,3.36,,United Kingdom,5,1493703
536592,21012,ANTIQUE ALL GLASS CANDLESTICK,6,12-01-2010 17:06,2.51,,United Kingdom,5,1549675
536592,21015,DARK BIRD HOUSE TREE DECORATION,1,12-01-2010 17:06,1.28,,United Kingdom,3,1522051
536592,21035,SET/2 RED RETROSPOT TEA TOWELS,2,12-01-2010 17:06,5.91,,United Kingdom,1,1148288
536592,21055,TOOL BOX SOFT TOY,2,12-01-2010 17:06,16.98,,United Kingdom,1,1737362
536592,21067,VINTAGE RED TEATIME MUG,1,12-01-2010 17:06,2.51,,United Kingdom,2,1028063
536592,21069,VINTAGE BILLBOARD TEA MUG,1,12-01-2010 17:06,2.51,,United Kingdom,4,1003195
536592,21071,VINTAGE BILLBOARD DRINK ME MUG,1,12-01-2010 17:06,2.51,,United Kingdom,3,1965433
536592,21098,CHRISTMAS TOILET ROLL,22,12-01-2010 17:06,2.51,,United Kingdom,5,1731880
536592,21108,FAIRY CAKE FLANNEL ASSORTED COLOUR,19,12-01-2010 17:06,5.06,,United Kingdom,1,1890731
536592,21109,"LARGE CAKE TOWEL, CHOCOLATE SPOTS",1,12-01-2010 17:06,13.57,,United Kingdom,1,1944094
536592,21110,LARGE CAKE TOWEL PINK SPOTS,2,12-01-2010 17:06,13.57,,United Kingdom,1,1639912
536592,21111,"SWISS ROLL TOWEL, CHOCOLATE  SPOTS",2,12-01-2010 17:06,5.91,,United Kingdom,5,1100517
536592,21128,GOLD FISHING GNOME,1,12-01-2010 17:06,12.72,,United Kingdom,1,1235860
536592,21154,RED RETROSPOT OVEN GLOVE,2,12-01-2010 17:06,2.51,,United Kingdom,2,1026327
536592,21164,HOME SWEET HOME METAL SIGN,1,12-01-2010 17:06,5.91,,United Kingdom,2,1075557
536592,21165,BEWARE OF THE CAT METAL SIGN,3,12-01-2010 17:06,4.21,,United Kingdom,3,1166635
536592,21174,POTTERING IN THE SHED METAL SIGN,4,12-01-2010 17:06,4.21,,United Kingdom,2,1047675
536592,21181,PLEASE ONE PERSON METAL SIGN,2,12-01-2010 17:06,4.21,,United Kingdom,3,1141087
536592,21188,3D HEARTS  HONEYCOMB PAPER GARLAND,2,12-01-2010 17:06,5.91,,United Kingdom,4,1379256
536592,21191,LARGE WHITE HONEYCOMB PAPER BELL,5,12-01-2010 17:06,4.21,,United Kingdom,4,1535523
536592,21192,WHITE BELL HONEYCOMB PAPER,2,12-01-2010 17:06,3.36,,United Kingdom,2,1219607
536592,21208,PASTEL COLOUR HONEYCOMB FAN,1,12-01-2010 17:06,3.36,,United Kingdom,3,1082731
536592,21212,PACK OF 72 RETROSPOT CAKE CASES,12,12-01-2010 17:06,1.28,,United Kingdom,1,1627046
536592,21213,PACK OF 72 SKULL CAKE CASES,1,12-01-2010 17:06,1.28,,United Kingdom,5,1675908
536592,21220,SET/4 BADGES DOGS,1,12-01-2010 17:06,2.51,,United Kingdom,2,1695556
536592,21231,SWEETHEART CERAMIC TRINKET BOX,8,12-01-2010 17:06,2.51,,United Kingdom,3,1938620
536592,21232,STRAWBERRY CERAMIC TRINKET BOX,5,12-01-2010 17:06,2.51,,United Kingdom,2,1212605
536592,21249,WOODLAND  HEIGHT CHART STICKERS,1,12-01-2010 17:06,5.91,,United Kingdom,3,1583059
536592,21257,VICTORIAN SEWING BOX MEDIUM,2,12-01-2010 17:06,16.13,,United Kingdom,2,1098527
536592,21258,VICTORIAN SEWING BOX LARGE,3,12-01-2010 17:06,25.49,,United Kingdom,4,1341640
536592,21262,WHITE GOOSE FEATHER CHRISTMAS TREE,1,12-01-2010 17:06,7.62,,United Kingdom,1,1267060
536592,21272,SALLE DE BAIN HOOK,1,12-01-2010 17:06,2.51,,United Kingdom,1,1500960
536592,21279,VINTAGE KITCHEN PRINT FRUITS,1,12-01-2010 17:06,5.06,,United Kingdom,5,1744258
536592,21281,VINTAGE KITCHEN PRINT SEAFOOD,1,12-01-2010 17:06,5.06,,United Kingdom,3,1725475
536592,21288,STRIPEY CHOCOLATE NESTING BOXES,1,12-01-2010 17:06,5.91,,United Kingdom,4,1370475
536592,21313,GLASS HEART T-LIGHT HOLDER,8,12-01-2010 17:06,1.66,,United Kingdom,5,1982739
536592,21314,SMALL GLASS HEART TRINKET POT,8,12-01-2010 17:06,4.21,,United Kingdom,2,1122019
536592,21340,CLASSIC METAL BIRDCAGE PLANT HOLDER,1,12-01-2010 17:06,25.49,,United Kingdom,3,1602517
536592,21349,IVY HEART WREATH,3,12-01-2010 17:06,13.57,,United Kingdom,4,1663090
536592,21352,EUCALYPTUS & PINECONE  WREATH,7,12-01-2010 17:06,5.91,,United Kingdom,1,1276564
536592,21356,TOAST ITS - FAIRY FLOWER,1,12-01-2010 17:06,2.51,,United Kingdom,1,1765601
536592,21429,RED GINGHAM ROSE JEWELLERY BOX,3,12-01-2010 17:06,3.36,,United Kingdom,2,1670533
536592,21439,BASKET OF TOADSTOOLS,1,12-01-2010 17:06,2.51,,United Kingdom,5,1508314
536592,21447,12 IVORY ROSE PEG PLACE SETTINGS,1,12-01-2010 17:06,2.51,,United Kingdom,3,1138503
536592,21479,WHITE SKULL HOT WATER BOTTLE,8,12-01-2010 17:06,7.62,,United Kingdom,5,1934550
536592,21481,FAWN BLUE HOT WATER BOTTLE,3,12-01-2010 17:06,5.91,,United Kingdom,2,1246474
536592,21484,CHICK GREY HOT WATER BOTTLE,2,12-01-2010 17:06,7.62,,United Kingdom,4,1059676
536592,21486,PINK HEART DOTS HOT WATER BOTTLE,7,12-01-2010 17:06,4.21,,United Kingdom,3,1694291
536592,21488,RED WHITE SCARF  HOT WATER BOTTLE,1,12-01-2010 17:06,8.47,,United Kingdom,5,1679049
536592,21494,ROTATING LEAVES T-LIGHT HOLDER,2,12-01-2010 17:06,5.06,,United Kingdom,5,1124547
536592,21519,GIN & TONIC DIET GREETING CARD,1,12-01-2010 17:06,0.85,,United Kingdom,4,1440381
536592,21520,BOOZE & WOMEN GREETING CARD,1,12-01-2010 17:06,0.85,,United Kingdom,2,1898767
536592,21524,DOORMAT SPOTTY HOME SWEET HOME,1,12-01-2010 17:06,14.43,,United Kingdom,1,1671425
536592,21537,RED RETROSPOT PUDDING BOWL,2,12-01-2010 17:06,8.47,,United Kingdom,1,1460477
536592,21544,SKULLS  WATER TRANSFER TATTOOS,1,12-01-2010 17:06,1.66,,United Kingdom,2,1756822
536592,21547,CERAMIC BIRDHOUSE CRESTED TIT SMALL,1,12-01-2010 17:06,5.91,,United Kingdom,4,1474712
536592,21557,SET OF 6 FUNKY BEAKERS,1,12-01-2010 17:06,5.91,,United Kingdom,3,1653045
536592,21559,STRAWBERRY LUNCH BOX WITH CUTLERY,1,12-01-2010 17:06,5.06,,United Kingdom,2,1695076
536592,21576,LETS GO SHOPPING COTTON TOTE BAG,1,12-01-2010 17:06,5.06,,United Kingdom,2,1836327
536592,21594,Dr. Jam's Arouzer Stress Ball,1,12-01-2010 17:06,4.21,,United Kingdom,4,1952104
536592,21638,ASSORTED TUTTI FRUTTI NOTEBOOK,1,12-01-2010 17:06,4.21,,United Kingdom,2,1467466
536592,21648,ASSORTED TUTTI FRUTTI SMALL PURSE,3,12-01-2010 17:06,2.51,,United Kingdom,4,1847578
536592,21656,RIDGED GLASS POSY VASE,1,12-01-2010 17:06,3.36,,United Kingdom,3,1404632
536592,21658,GLASS  BEURRE DISH,1,12-01-2010 17:06,8.47,,United Kingdom,1,1574272
536592,21671,RED SPOT CERAMIC DRAWER KNOB,2,12-01-2010 17:06,2.51,,United Kingdom,5,1429026
536592,21684,SMALL MEDINA STAMPED METAL BOWL,1,12-01-2010 17:06,2.51,,United Kingdom,5,1732854
536592,21698,MOCK LOBSTER FRIDGE MAGNET,1,12-01-2010 17:06,1.66,,United Kingdom,4,1400015
536592,21700,BIG DOUGHNUT FRIDGE MAGNETS,1,12-01-2010 17:06,8.47,,United Kingdom,4,1389260
536592,21705,BAG 500g SWIRLY MARBLES,2,12-01-2010 17:06,3.36,,United Kingdom,3,1210606
536592,21718,RED METAL BEACH SPADE,1,12-01-2010 17:06,2.51,,United Kingdom,2,1786493
536592,21731,RED TOADSTOOL LED NIGHT LIGHT,1,12-01-2010 17:06,3.36,,United Kingdom,2,1258701
536592,21743,STAR PORTABLE TABLE LIGHT,1,12-01-2010 17:06,5.91,,United Kingdom,1,1802628
536592,21745,GAOLERS KEYS DECORATIVE GARDEN,1,12-01-2010 17:06,8.47,,United Kingdom,4,1525133
536592,21754,HOME BUILDING BLOCK WORD,1,12-01-2010 17:06,11.87,,United Kingdom,4,1217882
536592,21755,LOVE BUILDING BLOCK WORD,1,12-01-2010 17:06,11.87,,United Kingdom,3,1300121
536592,21756,BATH BUILDING BLOCK WORD,1,12-01-2010 17:06,11.87,,United Kingdom,4,1232263
536592,21773,DECORATIVE ROSE BATHROOM BOTTLE,3,12-01-2010 17:06,2.51,,United Kingdom,1,1622470
536592,21774,DECORATIVE CATS BATHROOM BOTTLE,5,12-01-2010 17:06,2.51,,United Kingdom,2,1153778
536592,21775,DECORATIVE FLORE BATHROOM BOTTLE,3,12-01-2010 17:06,2.51,,United Kingdom,4,1790793
536592,21777,RECIPE BOX WITH METAL HEART,2,12-01-2010 17:06,7.95,,United Kingdom,5,1276225
536592,21786,POLKADOT RAIN HAT,7,12-01-2010 17:06,0.85,,United Kingdom,5,1026644
536592,21789,KIDS RAIN MAC PINK,2,12-01-2010 17:06,1.66,,United Kingdom,4,1283521
536592,21790,VINTAGE SNAP CARDS,5,12-01-2010 17:06,1.66,,United Kingdom,3,1872020
536592,21791,VINTAGE HEADS AND TAILS CARD GAME,1,12-01-2010 17:06,2.51,,United Kingdom,4,1981417
536592,21801,CHRISTMAS TREE DECORATION WITH BELL,10,12-01-2010 17:06,0.43,,United Kingdom,4,1997937
536592,21802,CHRISTMAS TREE HEART DECORATION,17,12-01-2010 17:06,0.43,,United Kingdom,1,1271904
536592,21803,CHRISTMAS TREE STAR DECORATION,12,12-01-2010 17:06,0.43,,United Kingdom,1,1299333
536592,21809,CHRISTMAS HANGING TREE WITH BELL,1,12-01-2010 17:06,2.51,,United Kingdom,2,1383907
536592,21813,GARLAND WITH STARS AND BELLS,1,12-01-2010 17:06,10.17,,United Kingdom,2,1920189
536592,21820,GLITTER HEART GARLAND WITH BELLS,1,12-01-2010 17:06,7.62,,United Kingdom,1,1866859
536592,21821,GLITTER STAR GARLAND WITH BELLS,1,12-01-2010 17:06,7.62,,United Kingdom,2,1860514
536592,21830,ASSORTED CREEPY CRAWLIES,1,12-01-2010 17:06,0.85,,United Kingdom,5,1480956
536592,21832,CHOCOLATE CALCULATOR,3,12-01-2010 17:06,3.36,,United Kingdom,5,1185738
536592,21833,CAMOUFLAGE LED TORCH,2,12-01-2010 17:06,3.36,,United Kingdom,4,1196495
536592,21844,RED RETROSPOT MUG,1,12-01-2010 17:06,5.91,,United Kingdom,1,1414250
536592,21846,PINK DIAMANTE PEN IN GIFT BOX,4,12-01-2010 17:06,4.21,,United Kingdom,2,1190319
536592,21851,LILAC DIAMANTE PEN IN GIFT BOX,3,12-01-2010 17:06,4.21,,United Kingdom,5,1178732
536592,21868,POTTING SHED TEA MUG,2,12-01-2010 17:06,3.36,,United Kingdom,5,1223651
536592,21871,SAVE THE PLANET MUG,3,12-01-2010 17:06,3.36,,United Kingdom,3,1722923
536592,21875,KINGS CHOICE MUG,1,12-01-2010 17:06,3.36,,United Kingdom,2,1654160
536592,21879,HEARTS GIFT TAPE,1,12-01-2010 17:06,1.66,,United Kingdom,2,1642111
536592,21889,WOODEN BOX OF DOMINOES,2,12-01-2010 17:06,2.51,,United Kingdom,1,1706032
536592,21891,TRADITIONAL WOODEN SKIPPING ROPE,4,12-01-2010 17:06,2.51,,United Kingdom,3,1640698
536592,21892,TRADITIONAL WOODEN CATCH CUP GAME,1,12-01-2010 17:06,2.51,,United Kingdom,1,1452909
536592,21896,POTTING SHED TWINE,1,12-01-2010 17:06,4.21,,United Kingdom,2,1054405
536592,21899,"KEY FOB , GARAGE DESIGN",1,12-01-2010 17:06,1.66,,United Kingdom,4,1296097
536592,21906,PHARMACIE FIRST AID TIN,1,12-01-2010 17:06,13.57,,United Kingdom,5,1762072
536592,21908,CHOCOLATE THIS WAY METAL SIGN,1,12-01-2010 17:06,4.21,,United Kingdom,5,1908673
536592,21914,BLUE HARMONICA IN BOX,2,12-01-2010 17:06,2.51,,United Kingdom,4,1639544
536592,21915,RED  HARMONICA IN BOX,3,12-01-2010 17:06,2.51,,United Kingdom,3,1607283
536592,21929,JUMBO BAG PINK VINTAGE PAISLEY,1,12-01-2010 17:06,4.21,,United Kingdom,4,1336186
536592,21931,JUMBO STORAGE BAG SUKI,1,12-01-2010 17:06,4.21,,United Kingdom,3,1678282
536592,21934,SKULL SHOULDER BAG,1,12-01-2010 17:06,3.36,,United Kingdom,1,1286179
536592,21935,SUKI  SHOULDER BAG,2,12-01-2010 17:06,3.36,,United Kingdom,1,1171749
536592,21942,SKULLS DESIGN FLANNEL,2,12-01-2010 17:06,1.66,,United Kingdom,4,1108698
536592,21949,SET OF 6 STRAWBERRY CHOPSTICKS,2,12-01-2010 17:06,2.51,,United Kingdom,1,1262852
536592,21974,SET OF 36 PAISLEY FLOWER DOILIES,5,12-01-2010 17:06,2.98,,United Kingdom,5,1962645
536592,21975,PACK OF 60 DINOSAUR CAKE CASES,11,12-01-2010 17:06,1.28,,United Kingdom,5,1219748
536592,21976,PACK OF 60 MUSHROOM CAKE CASES,1,12-01-2010 17:06,1.28,,United Kingdom,3,1765657
536592,21977,PACK OF 60 PINK PAISLEY CAKE CASES,21,12-01-2010 17:06,1.28,,United Kingdom,3,1893723
536592,21981,PACK OF 12 WOODLAND TISSUES,1,12-01-2010 17:06,0.85,,United Kingdom,4,1179425
536592,21982,PACK OF 12 SUKI TISSUES,2,12-01-2010 17:06,0.85,,United Kingdom,3,1121818
536592,21984,PACK OF 12 PINK PAISLEY TISSUES,1,12-01-2010 17:06,0.85,,United Kingdom,3,1822824
536592,21985,PACK OF 12 HEARTS DESIGN TISSUES,1,12-01-2010 17:06,0.85,,United Kingdom,1,1493897
536592,21990,MODERN FLORAL STATIONERY SET,2,12-01-2010 17:06,2.51,,United Kingdom,3,1673155
536592,21991,BOHEMIAN COLLAGE STATIONERY SET,2,12-01-2010 17:06,2.51,,United Kingdom,5,1152411
536592,21992,VINTAGE PAISLEY STATIONERY SET,14,12-01-2010 17:06,2.51,,United Kingdom,2,1129026
536592,21993,FLORAL FOLK STATIONERY SET,6,12-01-2010 17:06,2.51,,United Kingdom,1,1059629
536592,22064,PINK DOUGHNUT TRINKET POT,2,12-01-2010 17:06,3.36,,United Kingdom,3,1764403
536592,22065,CHRISTMAS PUDDING TRINKET POT,1,12-01-2010 17:06,3.36,,United Kingdom,3,1957183
536592,22077,6 RIBBONS RUSTIC CHARM,7,12-01-2010 17:06,3.36,,United Kingdom,2,1633612
536592,22078,RIBBON REEL LACE DESIGN,1,12-01-2010 17:06,4.21,,United Kingdom,3,1858542
536592,22081,RIBBON REEL FLORA + FAUNA,2,12-01-2010 17:06,3.36,,United Kingdom,4,1776160
536592,22082,RIBBON REEL STRIPES DESIGN,6,12-01-2010 17:06,3.36,,United Kingdom,2,1736060
536592,22083,PAPER CHAIN KIT RETROSPOT,2,12-01-2010 17:06,5.91,,United Kingdom,2,1705743
536592,22084,PAPER CHAIN KIT EMPIRE,1,12-01-2010 17:06,5.91,,United Kingdom,4,1298672
536592,22086,PAPER CHAIN KIT 50'S CHRISTMAS,22,12-01-2010 17:06,5.91,,United Kingdom,2,1490688
536592,22090,PAPER BUNTING RETROSPOT,1,12-01-2010 17:06,5.91,,United Kingdom,3,1690347
536592,22091,EMPIRE TISSUE BOX,2,12-01-2010 17:06,2.51,,United Kingdom,1,1087242
536592,22100,SKULLS SQUARE TISSUE BOX,1,12-01-2010 17:06,2.51,,United Kingdom,2,1187118
536592,22109,FULL ENGLISH BREAKFAST PLATE,2,12-01-2010 17:06,7.62,,United Kingdom,1,1869505
536592,22111,SCOTTIE DOG HOT WATER BOTTLE,3,12-01-2010 17:06,11.02,,United Kingdom,5,1724472
536592,22112,CHOCOLATE HOT WATER BOTTLE,3,12-01-2010 17:06,11.02,,United Kingdom,3,1510866
536592,22114,HOT WATER BOTTLE TEA AND SYMPATHY,3,12-01-2010 17:06,8.47,,United Kingdom,5,1367438
536592,22117,METAL SIGN HER DINNER IS SERVED,1,12-01-2010 17:06,5.91,,United Kingdom,4,1164589
536592,22121,NOEL WOODEN BLOCK LETTERS,1,12-01-2010 17:06,11.87,,United Kingdom,2,1741671
536592,22124,SET OF 2 TEA TOWELS PING MICROWAVE,2,12-01-2010 17:06,2.51,,United Kingdom,5,1122344
536592,22134,LADLE LOVE HEART RED,4,12-01-2010 17:06,0.85,,United Kingdom,5,1401733
536592,22135,LADLE LOVE HEART PINK,4,12-01-2010 17:06,0.85,,United Kingdom,1,1108457
536592,22141,CHRISTMAS CRAFT TREE TOP ANGEL,4,12-01-2010 17:06,4.21,,United Kingdom,1,1127737
536592,22142,CHRISTMAS CRAFT WHITE FAIRY,1,12-01-2010 17:06,3.36,,United Kingdom,4,1107228
536592,22144,CHRISTMAS CRAFT LITTLE FRIENDS,2,12-01-2010 17:06,4.21,,United Kingdom,4,1046349
536592,22147,FELTCRAFT BUTTERFLY HEARTS,2,12-01-2010 17:06,3.36,,United Kingdom,2,1086572
536592,22149,FELTCRAFT 6 FLOWER FRIENDS,2,12-01-2010 17:06,4.21,,United Kingdom,1,1178116
536592,22161,HEART DECORATION RUSTIC HANGING,7,12-01-2010 17:06,0.81,,United Kingdom,2,1342507
536592,22162,HEART GARLAND RUSTIC PADDED,3,12-01-2010 17:06,3.36,,United Kingdom,5,1759374
536592,22165,"DIAMANTE HEART SHAPED WALL MIRROR, ",1,12-01-2010 17:06,11.02,,United Kingdom,2,1067654
536592,22169,FAMILY ALBUM WHITE PICTURE FRAME,1,12-01-2010 17:06,16.98,,United Kingdom,3,1291013
536592,22174,PHOTO CUBE,5,12-01-2010 17:06,3.36,,United Kingdom,1,1468182
536592,22178,VICTORIAN GLASS HANGING T-LIGHT,8,12-01-2010 17:06,2.51,,United Kingdom,4,1373642
536592,22182,CAKE STAND VICTORIAN FILIGREE SMALL,1,12-01-2010 17:06,4.21,,United Kingdom,1,1595728
536592,22183,CAKE STAND VICTORIAN FILIGREE MED,2,12-01-2010 17:06,5.91,,United Kingdom,1,1722811
536592,22184,CAKE STAND VICTORIAN FILIGREE LARGE,1,12-01-2010 17:06,8.47,,United Kingdom,2,1505402
536592,22188,BLACK HEART CARD HOLDER,2,12-01-2010 17:06,8.47,,United Kingdom,4,1370699
536592,22190,LOCAL CAFE MUG,3,12-01-2010 17:06,2.51,,United Kingdom,3,1332355
536592,22195,LARGE HEART MEASURING SPOONS,4,12-01-2010 17:06,3.36,,United Kingdom,5,1581966
536592,22197,SMALL POPCORN HOLDER,34,12-01-2010 17:06,1.66,,United Kingdom,4,1035481
536592,22198,LARGE POPCORN HOLDER,2,12-01-2010 17:06,3.36,,United Kingdom,5,1899177
536592,22207,FRYING PAN UNION FLAG,1,12-01-2010 17:06,8.47,,United Kingdom,3,1478315
536592,22208,WOOD STAMP SET THANK YOU,1,12-01-2010 17:06,3.36,,United Kingdom,3,1523708
536592,22245,"HOOK, 1 HANGER ,MAGIC GARDEN",2,12-01-2010 17:06,1.66,,United Kingdom,3,1998057
536592,22246,MAGIC GARDEN FELT GARLAND,2,12-01-2010 17:06,4.21,,United Kingdom,5,1795318
536592,22260,FELT EGG COSY BLUE RABBIT,2,12-01-2010 17:06,1.66,,United Kingdom,2,1901030
536592,22261,FELT EGG COSY WHITE RABBIT,2,12-01-2010 17:06,1.66,,United Kingdom,3,1300216
536592,22262,FELT EGG COSY CHICKEN,3,12-01-2010 17:06,1.66,,United Kingdom,1,1366827
536592,22276,WASH BAG VINTAGE ROSE PAISLEY,2,12-01-2010 17:06,5.91,,United Kingdom,1,1383867
536592,22277,COSMETIC BAG VINTAGE ROSE PAISLEY,2,12-01-2010 17:06,4.21,,United Kingdom,3,1947413
536592,22278,OVERNIGHT BAG VINTAGE ROSE PAISLEY,1,12-01-2010 17:06,11.02,,United Kingdom,2,1919623
536592,22283,6 EGG HOUSE PAINTED WOOD,1,12-01-2010 17:06,16.13,,United Kingdom,1,1317799
536592,22294,HEART FILIGREE DOVE  SMALL,3,12-01-2010 17:06,2.51,,United Kingdom,4,1764317
536592,22300,COFFEE MUG DOG + BALL DESIGN,2,12-01-2010 17:06,5.06,,United Kingdom,3,1731326
536592,22301,COFFEE MUG CAT + BIRD DESIGN,2,12-01-2010 17:06,5.06,,United Kingdom,5,1672035
536592,22304,COFFEE MUG BLUE PAISLEY DESIGN,1,12-01-2010 17:06,5.06,,United Kingdom,3,1017596
536592,22308,TEA COSY BLUE STRIPE,1,12-01-2010 17:06,5.06,,United Kingdom,4,1620508
536592,22309,TEA COSY RED  STRIPE,1,12-01-2010 17:06,5.06,,United Kingdom,1,1150705
536592,22310,IVORY KNITTED MUG COSY,1,12-01-2010 17:06,3.36,,United Kingdom,4,1691920
536592,22311,OFFICE MUG WARMER BLACK+SILVER,2,12-01-2010 17:06,5.91,,United Kingdom,2,1828413
536592,22312,OFFICE MUG WARMER POLKADOT,1,12-01-2010 17:06,5.91,,United Kingdom,4,1330830
536592,22314,OFFICE MUG WARMER CHOC+BLUE,1,12-01-2010 17:06,5.91,,United Kingdom,2,1011438
536592,22317,FIVE CATS HANGING DECORATION,2,12-01-2010 17:06,5.91,,United Kingdom,1,1043593
536592,22324,BLUE POLKADOT KIDS BAG,1,12-01-2010 17:06,4.21,,United Kingdom,1,1551303
536592,22325,MOBILE VINTAGE HEARTS,1,12-01-2010 17:06,11.87,,United Kingdom,4,1301785
536592,22331,WOODLAND PARTY BAG + STICKER SET,1,12-01-2010 17:06,3.36,,United Kingdom,1,1413438
536592,22342,HOME GARLAND PAINTED ZINC,1,12-01-2010 17:06,3.36,,United Kingdom,4,1540143
536592,22348,TEA BAG PLATE RED RETROSPOT,2,12-01-2010 17:06,1.66,,United Kingdom,4,1311029
536592,22350,ILLUSTRATED CAT BOWL,2,12-01-2010 17:06,5.06,,United Kingdom,4,1999435
536592,22352,LUNCH BOX WITH CUTLERY RETROSPOT,1,12-01-2010 17:06,5.06,,United Kingdom,4,1988904
536592,22355,CHARLOTTE BAG SUKI DESIGN,2,12-01-2010 17:06,1.66,,United Kingdom,1,1636049
536592,22356,CHARLOTTE BAG PINK POLKADOT,6,12-01-2010 17:06,1.66,,United Kingdom,4,1823308
536592,22364,GLASS JAR DIGESTIVE BISCUITS,1,12-01-2010 17:06,5.91,,United Kingdom,5,1111247
536592,22371,AIRLINE BAG VINTAGE TOKYO 78,3,12-01-2010 17:06,8.47,,United Kingdom,1,1673573
536592,22376,AIRLINE BAG VINTAGE JET SET WHITE,2,12-01-2010 17:06,8.47,,United Kingdom,2,1769865
536592,22379,RECYCLING BAG RETROSPOT,2,12-01-2010 17:06,4.21,,United Kingdom,2,1079292
536592,22381,TOY TIDY PINK POLKADOT,1,12-01-2010 17:06,4.21,,United Kingdom,3,1635144
536592,22386,JUMBO BAG PINK POLKADOT,3,12-01-2010 17:06,4.21,,United Kingdom,1,1438874
536592,22393,PAPERWEIGHT VINTAGE COLLAGE,1,12-01-2010 17:06,5.06,,United Kingdom,1,1475722
536592,22396,MAGNETS PACK OF 4 RETRO PHOTO,1,12-01-2010 17:06,2.51,,United Kingdom,4,1932314
536592,22405,MONEY BOX POCKET MONEY DESIGN,1,12-01-2010 17:06,2.51,,United Kingdom,4,1463015
